text,term_true,cat_true,pol_true,analysis
the best chuwam mushi i have ever had .,['FOOD'],['QUALITY'],['2'],"[{'category': 'Quality', 'aspect': 'Food', 'segment': 'the best chuwam mushi i have ever had', 'sentiment': 'positive'}]"
"good sushi , high price","['FOOD', 'FOOD']","['QUALITY', 'PRICES']","['2', '0']","[{'category': 'Quality', 'aspect': 'Food', 'segment': 'good sushi', 'sentiment': 'positive'}, {'category': 'Prices', 'aspect': 'Food', 'segment': 'high price', 'sentiment': 'negative'}]"
one of the best sushi place in town .,['RESTAURANT'],['GENERAL'],['2'],"[{'category': 'Quality', 'aspect': 'Food', 'segment': 'one of the best sushi place in town', 'sentiment': 'positive'}]"
the house special roll is really good .,['FOOD'],['QUALITY'],['2'],"[{'category': 'Quality', 'aspect': 'Food', 'segment': 'the house special roll is really good', 'sentiment': 'positive'}]"
"brunch at murphy ' s is to die for , my specialty . . . egg white omelet , the food is always freshly prepared .","['FOOD', 'FOOD', 'FOOD']","['QUALITY', 'QUALITY', 'QUALITY']","['2', '2', '2']","[{'category': 'Quality', 'aspect': 'Food', 'segment': ""brunch at murphy ' s is to die for"", 'sentiment': 'positive'}, {'category': 'Quality', 'aspect': 'Food', 'segment': 'my specialty . . . egg white omelet , the food is always freshly prepared', 'sentiment': 'positive'}]"
it ' s the perfect spot for a romantic date for 2 or a secret rendezvous !,"['RESTAURANT', 'AMBIENCE']","['MISCELLANEOUS', 'GENERAL']","['2', '2']","[{'category': 'General', 'aspect': 'Restaurant', 'segment': 'perfect spot for a romantic date for 2 or a secret rendezvous', 'sentiment': 'positive'}]"
save room for scrumptious desserts .,['FOOD'],['QUALITY'],['2'],"[{'category': 'Quality', 'aspect': 'Food', 'segment': 'scrumptious desserts', 'sentiment': 'positive'}]"
the restaurant offers an extensive wine list and an ambiance you wo n ' t forget !,"['DRINKS', 'AMBIENCE']","['STYLE_OPTIONS', 'GENERAL']","['2', '2']","[{'category': 'Style_Options', 'aspect': 'Drinks', 'segment': 'the restaurant offers an extensive wine list', 'sentiment': 'positive'}, {'category': 'General', 'aspect': 'Ambience', 'segment': ""an ambiance you wo n ' t forget"", 'sentiment': 'positive'}]"
– best mexican place for lunch in the financial district .,['RESTAURANT'],['GENERAL'],['2'],"[{'category': 'General', 'aspect': 'Restaurant', 'segment': 'best mexican place for lunch in the financial district', 'sentiment': 'positive'}]"
love the enchiladas and chicken soup - and be sure to check out their specials .,"['FOOD', 'FOOD', 'FOOD']","['QUALITY', 'QUALITY', 'QUALITY']","['2', '2', '2']","[{'category': 'Quality', 'aspect': 'Food', 'segment': 'love the enchiladas and chicken soup', 'sentiment': 'positive'}, {'category': 'Style_Options', 'aspect': 'Food', 'segment': 'check out their specials', 'sentiment': 'positive'}]"
the cooks have been at the restaurant for years and cook family recipes .,['FOOD'],['QUALITY'],['2'],"[{'category': 'Quality', 'aspect': 'Food', 'segment': 'the cooks have been at the restaurant for years', 'sentiment': 'positive'}, {'category': 'Quality', 'aspect': 'Food', 'segment': 'cook family recipes', 'sentiment': 'positive'}]"
"can get busy on fridays for a table but once seated , the service is so efficient you can be in and out of there quickly .",['SERVICE'],['GENERAL'],['2'],"[{'category': 'General', 'aspect': 'Service', 'segment': 'the service is so efficient you can be in and out of there quickly', 'sentiment': 'positive'}, {'category': 'General', 'aspect': 'Restaurant', 'segment': 'can get busy on fridays for a table', 'sentiment': 'negative'}]"
the sushi was excellent and the wait staff was quick .,"['FOOD', 'SERVICE']","['QUALITY', 'GENERAL']","['2', '2']","[{'category': 'Quality', 'aspect': 'Food', 'segment': 'sushi was excellent', 'sentiment': 'positive'}, {'category': 'General', 'aspect': 'Service', 'segment': 'wait staff was quick', 'sentiment': 'positive'}]"
the atmosphere was just okay .,['AMBIENCE'],['GENERAL'],['1'],"[{'category': 'General', 'aspect': 'Ambience', 'segment': 'the atmosphere was just okay', 'sentiment': 'neutral'}]"
"space was limited , but the food made up for it .","['RESTAURANT', 'FOOD']","['MISCELLANEOUS', 'QUALITY']","['0', '2']","[{'category': 'General', 'aspect': 'Restaurant', 'segment': 'space was limited', 'sentiment': 'negative'}, {'category': 'Quality', 'aspect': 'Food', 'segment': 'the food made up for it', 'sentiment': 'positive'}]"
we stood there for 10 minutes while employees walked back and forth ignoring us .,['SERVICE'],['GENERAL'],['0'],"[{'category': 'General', 'aspect': 'Service', 'segment': 'we stood there for 10 minutes while employees walked back and forth ignoring us', 'sentiment': 'negative'}]"
"finally , my wife stood face to face in front of one of the staff and she asked , ` ` are you waiting for a table ? ' '",['SERVICE'],['GENERAL'],['0'],"[{'category': 'General', 'aspect': 'Service', 'segment': ""my wife stood face to face in front of one of the staff and she asked , ` ` are you waiting for a table ? ' '"", 'sentiment': 'neutral'}]"
the caesar salad i ordered had so much lemon i could n ' t eat it .,['FOOD'],['QUALITY'],['0'],"[{'category': 'Quality', 'aspect': 'Food', 'segment': ""the caesar salad i ordered had so much lemon i could n ' t eat it"", 'sentiment': 'negative'}]"
"great food , better margaritas !","['FOOD', 'DRINKS']","['QUALITY', 'QUALITY']","['2', '2']","[{'category': 'Quality', 'aspect': 'Food', 'segment': 'great food', 'sentiment': 'positive'}, {'category': 'Quality', 'aspect': 'Drinks', 'segment': 'better margaritas', 'sentiment': 'positive'}]"
"– this is one of my top lunch spots , huge portions , fast service and amazing margaritas ! !","['FOOD', 'SERVICE', 'DRINKS', 'RESTAURANT']","['STYLE_OPTIONS', 'GENERAL', 'QUALITY', 'GENERAL']","['2', '2', '2', '2']","[{'category': 'General', 'aspect': 'Restaurant', 'segment': 'one of my top lunch spots', 'sentiment': 'positive'}, {'category': 'Style_Options', 'aspect': 'Food', 'segment': 'huge portions', 'sentiment': 'positive'}, {'category': 'General', 'aspect': 'Service', 'segment': 'fast service', 'sentiment': 'positive'}, {'category': 'Quality', 'aspect': 'Drinks', 'segment': 'amazing margaritas', 'sentiment': 'positive'}]"
"it gets really busy , so get there on the early side so you can grab a seat , if you do have to wait , its not bad because the service is quick !",['SERVICE'],['GENERAL'],['2'],"[{'category': 'General', 'aspect': 'Restaurant', 'segment': 'it gets really busy', 'sentiment': 'negative'}, {'category': 'General', 'aspect': 'Service', 'segment': 'the service is quick', 'sentiment': 'positive'}]"
"check out the art on the walls , very colorful !",['AMBIENCE'],['GENERAL'],['2'],"[{'category': 'General', 'aspect': 'Decor', 'segment': 'check out the art on the walls', 'sentiment': 'positive'}, {'category': 'General', 'aspect': 'Decor', 'segment': 'very colorful', 'sentiment': 'positive'}]"
i love this place !,['RESTAURANT'],['GENERAL'],['2'],"[{'category': 'General', 'aspect': 'Restaurant', 'segment': 'i love this place !', 'sentiment': 'positive'}]"
– i have been eating at this place for over 8 years now and i have never had one bad meal .,['FOOD'],['QUALITY'],['2'],"[{'category': 'Quality', 'aspect': 'Food', 'segment': 'i have never had one bad meal', 'sentiment': 'positive'}]"
i highly recommend this place to all that want to try indain food for the first time .,['FOOD'],['QUALITY'],['2'],"[{'category': 'Recommendation', 'aspect': 'Restaurant', 'segment': 'i highly recommend this place', 'sentiment': 'positive'}]"
the lunch menu is an awesome deal !,['FOOD'],['PRICES'],['2'],"[{'category': 'Prices', 'aspect': 'Lunch', 'segment': 'the lunch menu is an awesome deal', 'sentiment': 'positive'}]"
"plenty of food , trust me .",['FOOD'],['STYLE_OPTIONS'],['2'],"[{'category': 'Quantity', 'aspect': 'Food', 'segment': 'plenty of food', 'sentiment': 'positive'}]"
fresh ingrediants and super tasty .,"['FOOD', 'FOOD']","['QUALITY', 'QUALITY']","['2', '2']","[{'category': 'Quality', 'aspect': 'Food', 'segment': 'fresh ingrediants', 'sentiment': 'positive'}, {'category': 'Quality', 'aspect': 'Food', 'segment': 'super tasty', 'sentiment': 'positive'}]"
"best food , phenominal service","['FOOD', 'SERVICE']","['QUALITY', 'GENERAL']","['2', '2']","[{'category': 'Quality', 'aspect': 'Food', 'segment': 'best food', 'sentiment': 'positive'}, {'category': 'General', 'aspect': 'Service', 'segment': 'phenominal service', 'sentiment': 'positive'}, {'category': 'General', 'aspect': 'Ambience', 'segment': 'wonderful ambience', 'sentiment': 'positive'}]"
"for the finicky sushi eater and those who have sampled the best nyc has to offer , the fish is the freshest and the service is superb .","['FOOD', 'SERVICE']","['QUALITY', 'GENERAL']","['2', '2']","[{'category': 'Quality', 'aspect': 'Food', 'segment': 'the fish is the freshest', 'sentiment': 'positive'}, {'category': 'General', 'aspect': 'Service', 'segment': 'the service is superb', 'sentiment': 'positive'}]"
"not only can the selection be innovative , but there ' s a nice balance of traditional sushi as well .","['FOOD', 'FOOD']","['STYLE_OPTIONS', 'STYLE_OPTIONS']","['2', '2']","[{'category': 'Style_Options', 'aspect': 'Food', 'segment': 'the selection can be innovative', 'sentiment': 'positive'}, {'category': 'Style_Options', 'aspect': 'Food', 'segment': ""there ' s a nice balance of traditional sushi as well"", 'sentiment': 'positive'}]"
the nicest waiters in town .,['SERVICE'],['GENERAL'],['2'],"[{'category': 'General', 'aspect': 'Service', 'segment': 'the nicest waiters in town', 'sentiment': 'positive'}]"
– this place is unbelievably over - rated .,['RESTAURANT'],['GENERAL'],['0'],"[{'category': 'General', 'aspect': 'Restaurant', 'segment': 'this place is unbelievably over-rated', 'sentiment': 'negative'}]"
"if i want to stand in line on sunday for an hour to get average brunch food , then i would put murphy ' s at the top of the list .","['FOOD', 'SERVICE']","['QUALITY', 'GENERAL']","['1', '0']","[{'category': 'General', 'aspect': 'Restaurant', 'segment': 'if i want to stand in line on sunday for an hour to get average brunch food', 'sentiment': 'negative'}]"
the regular menu here is slightly above average that is not worth the snotty attitude that you receive .,"['FOOD', 'FOOD', 'SERVICE']","['QUALITY', 'QUALITY', 'GENERAL']","['1', '1', '0']","[{'category': 'Quality', 'aspect': 'Food', 'segment': 'the regular menu here is slightly above average', 'sentiment': 'positive'}, {'category': 'General', 'aspect': 'Service', 'segment': 'snotty attitude', 'sentiment': 'negative'}]"
"your a sushi fan , you love expertly cut fish , great sake , a killer soho location , and of course : salmon , tuna , fluke , yellow tail , cod , mackeral , jellyfish , sea urchin , shrimp , lobster , sea bream , trout , milk fish , blue fin tuna , eel , crab , sardine , monk fish , roe , scallop , oysters , and a varity of toro .","['FOOD', 'FOOD', 'DRINKS', 'LOCATION', 'FOOD', 'FOOD', 'FOOD', 'FOOD', 'FOOD', 'FOOD', 'FOOD', 'FOOD', 'FOOD', 'FOOD', 'FOOD', 'FOOD', 'FOOD', 'FOOD', 'FOOD', 'FOOD', 'FOOD', 'FOOD', 'FOOD', 'FOOD', 'FOOD', 'FOOD']","['QUALITY', 'STYLE_OPTIONS', 'QUALITY', 'GENERAL', 'QUALITY', 'QUALITY', 'QUALITY', 'QUALITY', 'QUALITY', 'QUALITY', 'QUALITY', 'QUALITY', 'QUALITY', 'QUALITY', 'QUALITY', 'QUALITY', 'QUALITY', 'QUALITY', 'QUALITY', 'QUALITY', 'QUALITY', 'QUALITY', 'QUALITY', 'QUALITY', 'QUALITY', 'STYLE_OPTIONS']","['2', '2', '2', '2', '2', '2', '2', '2', '2', '2', '2', '2', '2', '2', '2', '2', '2', '2', '2', '2', '2', '2', '2', '2', '2', '2']","[{'category': 'Style_Options', 'aspect': 'Food', 'segment': 'sushi', 'sentiment': 'positive'}, {'category': 'Quality', 'aspect': 'Food', 'segment': 'expertly cut fish', 'sentiment': 'positive'}, {'category': 'Style_Options', 'aspect': 'Drinks', 'segment': 'great sake', 'sentiment': 'positive'}, {'category': 'General', 'aspect': 'Location', 'segment': 'killer soho location', 'sentiment': 'positive'}, {'category': 'Style_Options', 'aspect': 'Food', 'segment': 'salmon , tuna , fluke , yellow tail , cod , mackeral , jellyfish , sea urchin , shrimp , lobster , sea bream , trout , milk fish , blue fin tuna , eel , crab , sardine , monk fish , roe , scallop , oysters , and a varity of toro', 'sentiment': 'positive'}]"
"there is only one place on the east coast that has it all , plus a lot more .",['RESTAURANT'],['GENERAL'],['2'],"[{'category': 'General', 'aspect': 'Restaurant', 'segment': 'there is only one place on the east coast that has it all , plus a lot more', 'sentiment': 'positive'}]"
bring your cell phone cause you may have to wait to get into the best sushi restaurant in the world : blue ribbon sushi .,['RESTAURANT'],['GENERAL'],['2'],"[{'category': 'General', 'aspect': 'Restaurant', 'segment': 'bring your cell phone cause you may have to wait to get into the best sushi restaurant in the world : blue ribbon sushi', 'sentiment': 'negative'}]"
"hands down , the best tuna i have ever had .",['FOOD'],['QUALITY'],['2'],"[{'category': 'Quality', 'aspect': 'Food', 'segment': 'the best tuna i have ever had', 'sentiment': 'positive'}]"
blue ribbon lives up to it ' s fantastic reputation .,['RESTAURANT'],['GENERAL'],['2'],"[{'category': 'General', 'aspect': 'Restaurant', 'segment': ""blue ribbon lives up to it ' s fantastic reputation"", 'sentiment': 'positive'}]"
great value sushi with high quality & nice setting .,"['FOOD', 'FOOD', 'FOOD', 'AMBIENCE']","['PRICES', 'PRICES', 'QUALITY', 'GENERAL']","['2', '2', '2', '2']","[{'category': 'Quality', 'aspect': 'Food', 'segment': 'great value sushi with high quality', 'sentiment': 'positive'}, {'category': 'General', 'aspect': 'Ambience', 'segment': 'nice setting', 'sentiment': 'positive'}]"
try the chef ' s choice for sushi as the smoked yellowtail was incredible and the rolls were also tasty .,"['FOOD', 'FOOD', 'FOOD']","['QUALITY', 'QUALITY', 'QUALITY']","['2', '2', '2']","[{'category': 'Quality', 'aspect': 'Food', 'segment': ""the chef ' s choice for sushi as the smoked yellowtail was incredible and the rolls were also tasty"", 'sentiment': 'positive'}]"
poor customer service / poor pizza .,"['SERVICE', 'FOOD']","['GENERAL', 'QUALITY']","['0', '0']","[{'category': 'General', 'aspect': 'Service', 'segment': 'poor customer service', 'sentiment': 'negative'}, {'category': 'Quality', 'aspect': 'Food', 'segment': 'poor pizza', 'sentiment': 'negative'}]"
"– as with most restaurants in seattle , mioposto ' s service was bad and the food was overpriced .","['SERVICE', 'FOOD']","['GENERAL', 'PRICES']","['0', '0']","[{'category': 'General', 'aspect': 'Service', 'segment': 'service was bad', 'sentiment': 'negative'}, {'category': 'Prices', 'aspect': 'Food', 'segment': 'food was overpriced', 'sentiment': 'negative'}]"
"i know many people have their favorite types of pizza and pizza places , but mioposto ' s pizza lacks quality and good taste .",['FOOD'],['QUALITY'],['0'],"[{'category': 'Quality', 'aspect': 'Food', 'segment': ""mioposto's pizza lacks quality and good taste"", 'sentiment': 'negative'}]"
"to be honest , i ' ve had better frozen pizza .",['FOOD'],['QUALITY'],['0'],"[{'category': 'Quality', 'aspect': 'Food', 'segment': ""i ' ve had better frozen pizza"", 'sentiment': 'negative'}]"
the only positive thing about mioposto is the nice location .,"['LOCATION', 'RESTAURANT']","['GENERAL', 'GENERAL']","['2', '0']","[{'category': 'General', 'aspect': 'Location', 'segment': 'the nice location', 'sentiment': 'positive'}]"
"i was frankly shocked when i read the bad reviews - this place is fantastic ; it has not let us down in any way , and we ' ve eaten here more than 10 times .",['RESTAURANT'],['GENERAL'],['2'],"[{'category': 'General', 'aspect': 'Restaurant', 'segment': 'this place is fantastic', 'sentiment': 'positive'}, {'category': 'General', 'aspect': 'Restaurant', 'segment': 'it has not let us down in any way', 'sentiment': 'positive'}]"
"the food is fantastic , and the waiting staff has been perfect every single time we ' ve been there .","['FOOD', 'SERVICE']","['QUALITY', 'GENERAL']","['2', '2']","[{'category': 'Quality', 'aspect': 'Food', 'segment': 'the food is fantastic', 'sentiment': 'positive'}, {'category': 'General', 'aspect': 'Service', 'segment': ""the waiting staff has been perfect every single time we ' ve been there"", 'sentiment': 'positive'}]"
"the only problem would be the wait , but we usually just have a drink in the front while waiting .",['SERVICE'],['GENERAL'],['1'],"[{'category': 'General', 'aspect': 'Restaurant', 'segment': 'the only problem would be the wait', 'sentiment': 'negative'}, {'category': 'General', 'aspect': 'Restaurant', 'segment': 'we usually just have a drink in the front while waiting', 'sentiment': 'positive'}]"
seabass on lobster risotto was the best .,['FOOD'],['QUALITY'],['2'],"[{'category': 'Quality', 'aspect': 'Food', 'segment': 'seabass on lobster risotto was the best', 'sentiment': 'positive'}]"
caesar salad was superb .,['FOOD'],['QUALITY'],['2'],"[{'category': 'Quality', 'aspect': 'Food', 'segment': 'caesar salad was superb', 'sentiment': 'positive'}]"
great bottle of wine .,['DRINKS'],['QUALITY'],['2'],"[{'category': 'Quality', 'aspect': 'Drinks', 'segment': 'great bottle of wine', 'sentiment': 'positive'}]"
leave room for dessert .,['FOOD'],['QUALITY'],['2'],"[{'category': 'Recommendation', 'aspect': 'Food', 'segment': 'leave room for dessert', 'sentiment': 'positive'}]"
i waited for 10 - 15 minutes for service ordered a beer & was never served again .,['SERVICE'],['GENERAL'],['1'],"[{'category': 'General', 'aspect': 'Service', 'segment': 'i waited for 10 - 15 minutes for service', 'sentiment': 'negative'}, {'category': 'General', 'aspect': 'Service', 'segment': 'ordered a beer & was never served again', 'sentiment': 'negative'}]"
"the food was ok , but the service was so poor that the food was cold buy the time everyone in my party was served .","['FOOD', 'SERVICE']","['QUALITY', 'GENERAL']","['1', '0']","[{'category': 'Quality', 'aspect': 'Food', 'segment': 'the food was ok', 'sentiment': 'neutral'}, {'category': 'General', 'aspect': 'Service', 'segment': 'the service was so poor that the food was cold', 'sentiment': 'negative'}]"
avoid the place,['RESTAURANT'],['GENERAL'],['0'],"[{'category': 'Prices', 'aspect': 'Restaurant', 'segment': 'avoid the place if you are on a budget', 'sentiment': 'negative'}]"
when i got there i sat up stairs where the atmosphere was cozy & the service was horrible !,"['AMBIENCE', 'SERVICE']","['GENERAL', 'GENERAL']","['2', '0']","[{'category': 'General', 'aspect': 'Ambience', 'segment': 'atmosphere was cozy', 'sentiment': 'positive'}, {'category': 'General', 'aspect': 'Service', 'segment': 'service was horrible', 'sentiment': 'negative'}]"
we left without ever getting service .,['SERVICE'],['GENERAL'],['0'],"[{'category': 'General', 'aspect': 'Service', 'segment': 'we left without ever getting service', 'sentiment': 'negative'}]"
best crab cakes in town,['FOOD'],['QUALITY'],['2'],"[{'category': 'Quality', 'aspect': 'Food', 'segment': 'best crab cakes in town', 'sentiment': 'positive'}]"
– thats a big statement considering i ' ve been pulling crab traps and making the cakes myself since i was about seven - but something about these little devils gets better every time .,['FOOD'],['QUALITY'],['2'],"[{'category': 'Quality', 'aspect': 'Food', 'segment': 'something about these little devils gets better every time', 'sentiment': 'positive'}]"
"if you can , come to this place by boat and make it a whole evening .",['RESTAURANT'],['MISCELLANEOUS'],['2'],"[{'category': 'General', 'aspect': 'Restaurant', 'segment': 'come to this place by boat and make it a whole evening', 'sentiment': 'positive'}]"
"great seasonal fish and seafood , with a classy waterfront setting .","['FOOD', 'FOOD', 'AMBIENCE']","['QUALITY', 'QUALITY', 'GENERAL']","['2', '2', '2']","[{'category': 'Quality', 'aspect': 'Food', 'segment': 'great seasonal fish and seafood', 'sentiment': 'positive'}, {'category': 'General', 'aspect': 'Ambience', 'segment': 'classy waterfront setting', 'sentiment': 'positive'}]"
"great pizza , poor service","['FOOD', 'SERVICE']","['QUALITY', 'GENERAL']","['2', '0']","[{'category': 'Quality', 'aspect': 'Food', 'segment': 'great pizza', 'sentiment': 'positive'}, {'category': 'General', 'aspect': 'Service', 'segment': 'poor service', 'sentiment': 'negative'}]"
"– love their pizza , especially the mushroom pizza .","['FOOD', 'FOOD']","['QUALITY', 'QUALITY']","['2', '2']","[{'category': 'Quality', 'aspect': 'Food', 'segment': 'love their pizza , especially the mushroom pizza', 'sentiment': 'positive'}]"
also love their caeser salad .,['FOOD'],['QUALITY'],['2'],"[{'category': 'Quality', 'aspect': 'Food', 'segment': 'love their caeser salad', 'sentiment': 'positive'}]"
"prefer to order it and pick it up though because i do n ' t like the servers , one young woman in particular .","['SERVICE', 'SERVICE']","['GENERAL', 'GENERAL']","['0', '0']","[{'category': 'General', 'aspect': 'Service', 'segment': 'one young woman in particular', 'sentiment': 'negative'}]"
– this place is famous for their breakfast .,['FOOD'],['QUALITY'],['2'],"[{'category': 'Style_Options', 'aspect': 'Food', 'segment': 'this place is famous for their breakfast', 'sentiment': 'positive'}]"
"many people talk about the great pizza and poor service , so it ca n ' t just be the rantings of a few dissatisfied customers .","['FOOD', 'SERVICE']","['QUALITY', 'GENERAL']","['2', '0']","[{'category': 'Quality', 'aspect': 'Food', 'segment': 'great pizza', 'sentiment': 'positive'}, {'category': 'General', 'aspect': 'Service', 'segment': 'poor service', 'sentiment': 'negative'}]"
it ' s a great little place with tons of potential to be a neighborhood joint if the service were n ' t so impersonal and corporate - like .,"['RESTAURANT', 'SERVICE']","['GENERAL', 'GENERAL']","['2', '0']","[{'category': 'General', 'aspect': 'Restaurant', 'segment': 'great little place with tons of potential to be a neighborhood joint', 'sentiment': 'positive'}, {'category': 'General', 'aspect': 'Service', 'segment': ""service were n't so impersonal and corporate-like"", 'sentiment': 'negative'}]"
great breakfast,['FOOD'],['QUALITY'],['2'],"[{'category': 'General', 'aspect': 'Restaurant', 'segment': 'great breakfast spot', 'sentiment': 'positive'}]"
the food is great and they make a mean bloody mary .,"['FOOD', 'DRINKS']","['QUALITY', 'QUALITY']","['2', '2']","[{'category': 'Quality', 'aspect': 'Food', 'segment': 'the food is great', 'sentiment': 'positive'}, {'category': 'Quality', 'aspect': 'Drinks', 'segment': 'they make a mean bloody mary', 'sentiment': 'positive'}]"
i love breakfast here .,['FOOD'],['QUALITY'],['2'],"[{'category': 'Quality', 'aspect': 'Food', 'segment': 'i love breakfast here', 'sentiment': 'positive'}]"
their crab eggs benedict is addicting .,['FOOD'],['QUALITY'],['2'],"[{'category': 'Quality', 'aspect': 'Food', 'segment': 'crab eggs benedict is addicting', 'sentiment': 'positive'}]"
"all their menu items are a hit , and they serve mimosas .","['FOOD', 'DRINKS']","['QUALITY', 'STYLE_OPTIONS']","['2', '2']","[{'category': 'Style_Options', 'aspect': 'Food', 'segment': 'all their menu items are a hit', 'sentiment': 'positive'}, {'category': 'Style_Options', 'aspect': 'Drinks', 'segment': 'they serve mimosas', 'sentiment': 'positive'}]"
best chinese food i have tasted in a long time,['FOOD'],['QUALITY'],['2'],"[{'category': 'Quality', 'aspect': 'Food', 'segment': 'best chinese food i have tasted in a long time', 'sentiment': 'positive'}]"
the ambiance of the restaurant was nice and good for fine dinning .,"['AMBIENCE', 'AMBIENCE']","['GENERAL', 'GENERAL']","['2', '2']","[{'category': 'General', 'aspect': 'Ambience', 'segment': 'the ambiance of the restaurant was nice', 'sentiment': 'positive'}, {'category': 'General', 'aspect': 'Restaurant', 'segment': 'good for fine dinning', 'sentiment': 'positive'}]"
the staff was very nice and courteous and obviously chinese .,"['SERVICE', 'SERVICE']","['GENERAL', 'GENERAL']","['2', '2']","[{'category': 'General', 'aspect': 'Service', 'segment': 'the staff was very nice and courteous', 'sentiment': 'positive'}, {'category': 'General', 'aspect': 'Service', 'segment': 'obviously chinese', 'sentiment': 'neutral'}]"
"so about the prawns , they were fresh and had a slight crispiness about the batter . . . soooo good . . . the walnuts were cut in smaller pieces and very crunchy and tasty .","['FOOD', 'FOOD', 'FOOD', 'FOOD']","['QUALITY', 'QUALITY', 'QUALITY', 'QUALITY']","['2', '2', '2', '2']","[{'category': 'Quality', 'aspect': 'Food', 'segment': 'the prawns were fresh and had a slight crispiness about the batter', 'sentiment': 'positive'}, {'category': 'Quality', 'aspect': 'Food', 'segment': 'the walnuts were cut in smaller pieces and very crunchy and tasty', 'sentiment': 'positive'}]"
best honey walnyt prawns that we have every tasted .,['FOOD'],['QUALITY'],['2'],"[{'category': 'Quality', 'aspect': 'Food', 'segment': 'best honey walnyt prawns that we have every tasted', 'sentiment': 'positive'}]"
the brocollis were so fresh and tasty .,"['FOOD', 'FOOD']","['QUALITY', 'QUALITY']","['2', '2']","[{'category': 'Quality', 'aspect': 'Food', 'segment': 'the brocollis were so fresh and tasty', 'sentiment': 'positive'}]"
