text,term_true,cat_true,pol_true,analysis
"the food is fantastic , authentic , delicious and very , very affordable .","['FOOD', 'FOOD', 'FOOD', 'FOOD']","['QUALITY', 'QUALITY', 'QUALITY', 'PRICES']","['2', '2', '2', '2']","[{'category': 'Quality', 'aspect': 'Food', 'segment': 'the food is fantastic', 'sentiment': 'positive'}, {'category': 'Quality', 'aspect': 'Food', 'segment': 'authentic', 'sentiment': 'positive'}, {'category': 'Quality', 'aspect': 'Food', 'segment': 'delicious', 'sentiment': 'positive'}, {'category': 'Prices', 'aspect': 'Food', 'segment': 'very , very affordable', 'sentiment': 'positive'}]"
the decor was beautiful and unique .,"['AMBIENCE', 'AMBIENCE']","['GENERAL', 'GENERAL']","['2', '2']","[{'category': 'General', 'aspect': 'Ambience', 'segment': 'the decor was beautiful', 'sentiment': 'positive'}, {'category': 'General', 'aspect': 'Ambience', 'segment': 'the decor was unique', 'sentiment': 'positive'}]"
"there was a really nice vibe about the place . . . good music , atmosphere and happy looking people .","['AMBIENCE', 'AMBIENCE', 'AMBIENCE', 'RESTAURANT']","['GENERAL', 'GENERAL', 'GENERAL', 'MISCELLANEOUS']","['2', '2', '2', '2']","[{'category': 'General', 'aspect': 'Ambience', 'segment': 'there was a really nice vibe about the place', 'sentiment': 'positive'}, {'category': 'General', 'aspect': 'Ambience', 'segment': 'good music , atmosphere and happy looking people', 'sentiment': 'positive'}]"
our server was very professional and friendly .,"['SERVICE', 'SERVICE']","['GENERAL', 'GENERAL']","['2', '2']","[{'category': 'General', 'aspect': 'Service', 'segment': 'our server was very professional', 'sentiment': 'positive'}, {'category': 'General', 'aspect': 'Service', 'segment': 'our server was friendly', 'sentiment': 'positive'}]"
to the owners of open sesame . . . bravo . . . i ca n ' t wait to come back to dine at your restaurant !,['RESTAURANT'],['GENERAL'],['2'],"[{'category': 'General', 'aspect': 'Restaurant', 'segment': ""to the owners of open sesame . . . bravo . . . i ca n ' t wait to come back to dine at your restaurant !"", 'sentiment': 'positive'}]"
it ' s a tiny place so if you get there before 8pm on a weekend ( thurs ? sun ) you will find it easier to get a table or a seat at the sushi bar .,['RESTAURANT'],['MISCELLANEOUS'],['1'],"[{'category': 'General', 'aspect': 'Location', 'segment': ""it ' s a tiny place"", 'sentiment': 'neutral'}, {'category': 'General', 'aspect': 'Restaurant', 'segment': 'you will find it easier to get a table or a seat at the sushi bar', 'sentiment': 'positive'}]"
"everything , and i mean everything on the menu is delectable .",['FOOD'],['QUALITY'],['2'],"[{'category': 'Quality', 'aspect': 'Food', 'segment': 'everything on the menu is delectable', 'sentiment': 'positive'}]"
the waiters are very experienced and helpful with pairing your drink choice to your food tastes or vice versa .,"['SERVICE', 'SERVICE']","['GENERAL', 'GENERAL']","['2', '2']","[{'category': 'General', 'aspect': 'Service', 'segment': 'the waiters are very experienced', 'sentiment': 'positive'}, {'category': 'General', 'aspect': 'Service', 'segment': 'helpful with pairing your drink choice to your food tastes or vice versa', 'sentiment': 'positive'}]"
"the sushi is as fresh as it comes ? you ' d think ocean was in their backyard , no joke !",['FOOD'],['QUALITY'],['2'],"[{'category': 'Quality', 'aspect': 'Food', 'segment': 'the sushi is as fresh as it comes', 'sentiment': 'positive'}]"
"if you ' re interested in good tasting ( without the fish taste or smell ) , large portions and creative sushi dishes this is your place . . .","['FOOD', 'FOOD', 'FOOD']","['STYLE_OPTIONS', 'STYLE_OPTIONS', 'QUALITY']","['2', '2', '2']","[{'category': 'Quality', 'aspect': 'Food', 'segment': 'good tasting ( without the fish taste or smell ) , large portions and creative sushi dishes', 'sentiment': 'positive'}, {'category': 'Prices', 'aspect': 'Food', 'segment': 'be prepared to spend a bit more than average', 'sentiment': 'negative'}]"
big thick pepperoni,"['FOOD', 'FOOD']","['STYLE_OPTIONS', 'STYLE_OPTIONS']","['2', '2']","[{'category': 'Style_Options', 'aspect': 'Food', 'segment': 'big thick pepperoni pizza', 'sentiment': 'positive'}]"
– the pepperoni ' s cut real thick - - yum .,"['FOOD', 'FOOD']","['STYLE_OPTIONS', 'STYLE_OPTIONS']","['2', '2']","[{'category': 'Quality', 'aspect': 'Food', 'segment': ""the pepperoni ' s cut real thick - - yum"", 'sentiment': 'positive'}]"
"the pizza itself is not exactly the best i ' ve had ever , but still pretty good .",['FOOD'],['QUALITY'],['2'],"[{'category': 'Quality', 'aspect': 'Food', 'segment': 'pizza is not exactly the best', 'sentiment': 'negative'}, {'category': 'Quality', 'aspect': 'Food', 'segment': 'still pretty good', 'sentiment': 'positive'}]"
food was good and appetizing .,"['FOOD', 'FOOD']","['QUALITY', 'QUALITY']","['2', '2']","[{'category': 'Quality', 'aspect': 'Food', 'segment': 'food was good', 'sentiment': 'positive'}, {'category': 'Quality', 'aspect': 'Food', 'segment': 'food was appetizing', 'sentiment': 'positive'}]"
"portions was just enough for me , but may not be for a big eater .",['FOOD'],['STYLE_OPTIONS'],['1'],"[{'category': 'Quantity', 'aspect': 'Food', 'segment': 'portions was just enough for me', 'sentiment': 'positive'}, {'category': 'Quantity', 'aspect': 'Food', 'segment': 'portions may not be for a big eater', 'sentiment': 'negative'}]"
fair menu selection .,['FOOD'],['STYLE_OPTIONS'],['1'],"[{'category': 'Style_Options', 'aspect': 'Food', 'segment': 'fair menu selection', 'sentiment': 'neutral'}]"
"the appetizer was interesting , but the creme brulee was very savory and delicious .","['FOOD', 'FOOD', 'FOOD']","['QUALITY', 'QUALITY', 'QUALITY']","['2', '2', '2']","[{'category': 'Quality', 'aspect': 'Food', 'segment': 'the appetizer was interesting', 'sentiment': 'neutral'}, {'category': 'Quality', 'aspect': 'Food', 'segment': 'the creme brulee was very savory and delicious', 'sentiment': 'positive'}]"
indoor ambience was modern .,['AMBIENCE'],['GENERAL'],['2'],"[{'category': 'General', 'aspect': 'Ambience', 'segment': 'indoor ambience was modern', 'sentiment': 'positive'}]"
"if it ' s nice outside , request for a table in the balcony .",['AMBIENCE'],['GENERAL'],['2'],"[{'category': 'General', 'aspect': 'Ambience', 'segment': ""if it ' s nice outside , request for a table in the balcony"", 'sentiment': 'positive'}]"
it ' s a great place to people watch .,['RESTAURANT'],['MISCELLANEOUS'],['2'],"[{'category': 'General', 'aspect': 'Restaurant', 'segment': ""it ' s a great place to people watch"", 'sentiment': 'positive'}]"
late night dinning with exeptional food .,['FOOD'],['QUALITY'],['2'],"[{'category': 'General', 'aspect': 'Restaurant', 'segment': 'late night dinning', 'sentiment': 'positive'}, {'category': 'Quality', 'aspect': 'Food', 'segment': 'exeptional food', 'sentiment': 'positive'}]"
"we were seated right away , the table was private and nice .","['AMBIENCE', 'AMBIENCE', 'SERVICE']","['GENERAL', 'GENERAL', 'GENERAL']","['2', '2', '2']","[{'category': 'General', 'aspect': 'Service', 'segment': 'we were seated right away', 'sentiment': 'positive'}, {'category': 'General', 'aspect': 'Ambience', 'segment': 'the table was private and nice', 'sentiment': 'positive'}]"
the service was exceptional - sometime there was a feeling that we were served by the army of friendly waiters .,"['SERVICE', 'SERVICE']","['GENERAL', 'GENERAL']","['2', '2']","[{'category': 'General', 'aspect': 'Service', 'segment': 'the service was exceptional', 'sentiment': 'positive'}, {'category': 'General', 'aspect': 'Service', 'segment': 'we were served by the army of friendly waiters', 'sentiment': 'positive'}]"
"the food was very good , filet mignon was probably the best i ' ve ever try .","['FOOD', 'FOOD']","['QUALITY', 'QUALITY']","['2', '2']","[{'category': 'Quality', 'aspect': 'Food', 'segment': 'the food was very good', 'sentiment': 'positive'}, {'category': 'Quality', 'aspect': 'Food', 'segment': ""filet mignon was probably the best i ' ve ever try"", 'sentiment': 'positive'}]"
"the portions are big though , so do not order too much .",['FOOD'],['STYLE_OPTIONS'],['1'],"[{'category': 'Style_Options', 'aspect': 'Food', 'segment': 'portions are big', 'sentiment': 'positive'}]"
groovy music made the dinner casual .,['AMBIENCE'],['GENERAL'],['2'],"[{'category': 'General', 'aspect': 'Ambience', 'segment': 'groovy music made the dinner casual', 'sentiment': 'positive'}]"
i have a but here - there was a bathroom attendant in the restroom which was odd .,['RESTAURANT'],['MISCELLANEOUS'],['0'],"[{'category': 'General', 'aspect': 'Restaurant', 'segment': 'there was a bathroom attendant in the restroom which was odd', 'sentiment': 'negative'}]"
"the bathroom itself is very small with two toilets and only one sink , the girl was staying totally on the way hanging out paper towels from the dispenser .",['RESTAURANT'],['MISCELLANEOUS'],['0'],"[{'category': 'General', 'aspect': 'Bathroom', 'segment': 'bathroom itself is very small', 'sentiment': 'negative'}, {'category': 'General', 'aspect': 'Bathroom', 'segment': 'bathroom is small with two toilets and only one sink', 'sentiment': 'negative'}, {'category': 'General', 'aspect': 'Bathroom', 'segment': 'girl was staying totally on the way hanging out paper towels from the dispenser', 'sentiment': 'negative'}]"
"– mercedes restaurant is so tasty , the service is undeniably awesome !","['SERVICE', 'FOOD']","['GENERAL', 'QUALITY']","['2', '2']","[{'category': 'Quality', 'aspect': 'Food', 'segment': 'mercedes restaurant is so tasty', 'sentiment': 'positive'}, {'category': 'General', 'aspect': 'Service', 'segment': 'the service is undeniably awesome', 'sentiment': 'positive'}]"
"the catering is out of this world , and raouls chicken vegetable soup rocks my world ! ! !","['FOOD', 'FOOD']","['QUALITY', 'QUALITY']","['2', '2']","[{'category': 'Quality', 'aspect': 'Catering', 'segment': 'the catering is out of this world', 'sentiment': 'positive'}, {'category': 'Quality', 'aspect': 'Soup', 'segment': 'raouls chicken vegetable soup rocks my world ! ! !', 'sentiment': 'positive'}]"
"drinks are suberb , and i feel like i am in a third world country when i walk in the door .","['DRINKS', 'AMBIENCE']","['QUALITY', 'GENERAL']","['2', '2']","[{'category': 'Quality', 'aspect': 'Drinks', 'segment': 'drinks are suberb', 'sentiment': 'positive'}, {'category': 'General', 'aspect': 'Restaurant', 'segment': 'i feel like i am in a third world country when i walk in the door', 'sentiment': 'positive'}]"
the presentation of snooze is excellent and it is one of those places that you feel more sophisticated just for being there ; but peel back the layers and you have an overpriced ihop with a high brow menu .,"['AMBIENCE', 'RESTAURANT', 'FOOD']","['GENERAL', 'PRICES', 'STYLE_OPTIONS']","['0', '0', '0']","[{'category': 'General', 'aspect': 'Restaurant', 'segment': 'presentation of snooze is excellent', 'sentiment': 'positive'}, {'category': 'General', 'aspect': 'Restaurant', 'segment': 'you feel more sophisticated just for being there', 'sentiment': 'positive'}, {'category': 'Quality', 'aspect': 'Food', 'segment': 'overpriced ihop with a high brow menu', 'sentiment': 'negative'}]"
"to start off , approximately 8 - 10 oz of orange juice will cost you $ 3 .",['DRINKS'],['PRICES'],['0'],"[{'category': 'Prices', 'aspect': 'Drinks', 'segment': 'approximately 8 - 10 oz of orange juice will cost you $ 3', 'sentiment': 'negative'}]"
"they serve it in a tall , skinny hour - glass shaped glass to disguise the fact that you a getting a small juice at the price of a half gallon in a supermarket .","['DRINKS', 'DRINKS']","['STYLE_OPTIONS', 'PRICES']","['0', '0']","[{'category': 'Quality', 'aspect': 'Drinks', 'segment': 'small juice at the price of a half gallon in a supermarket', 'sentiment': 'negative'}]"
i should have just asked for the check when i saw that ; but their menu was so unique that i continued .,['FOOD'],['STYLE_OPTIONS'],['2'],"[{'category': 'Prices', 'aspect': 'Restaurant', 'segment': 'i should have just asked for the check when i saw that', 'sentiment': 'negative'}, {'category': 'Style_Options', 'aspect': 'Food', 'segment': 'but their menu was so unique that i continued', 'sentiment': 'positive'}]"
the pancakes were certainly inventive but $ 8 . 50 for 3 - 6 ' ' pancakes ( one of them was more like 5 ' ' ) in the pancake flight ( sample of 3 different pancakes ) is well over - priced .,"['FOOD', 'FOOD']","['STYLE_OPTIONS', 'PRICES']","['2', '0']","[{'category': 'Quality', 'aspect': 'Food', 'segment': 'pancakes were certainly inventive', 'sentiment': 'positive'}, {'category': 'Prices', 'aspect': 'Food', 'segment': ""$ 8 . 50 for 3 - 6 ' ' pancakes ( one of them was more like 5 ' ' ) in the pancake flight ( sample of 3 different pancakes ) is well over - priced"", 'sentiment': 'negative'}]"
the pancakes should be larger ( at least 8 ' ' ) to justify the expense even with the unique offerings .,"['FOOD', 'FOOD']","['STYLE_OPTIONS', 'PRICES']","['0', '0']","[{'category': 'Quality', 'aspect': 'Food', 'segment': 'the pancakes should be larger', 'sentiment': 'negative'}, {'category': 'Prices', 'aspect': 'Food', 'segment': 'to justify the expense', 'sentiment': 'negative'}]"
"on my meal i had to send back my eggs for a simple request of breaking the yokes before cooking , and would have had to send them back again if i had n ' t rejected the meal all together .","['FOOD', 'FOOD']","['QUALITY', 'QUALITY']","['0', '0']","[{'category': 'Quality', 'aspect': 'Food', 'segment': 'had to send back my eggs for a simple request of breaking the yokes before cooking', 'sentiment': 'negative'}, {'category': 'Quality', 'aspect': 'Food', 'segment': ""would have had to send them back again if i had n ' t rejected the meal all together"", 'sentiment': 'negative'}]"
i rejected it because in the process of attempting to fix the eggs they broke something else in the dish and i was too frustrated to continue .,['FOOD'],['QUALITY'],['0'],"[{'category': 'Quality', 'aspect': 'Food', 'segment': 'in the process of attempting to fix the eggs they broke something else in the dish', 'sentiment': 'negative'}, {'category': 'Quality', 'aspect': 'Food', 'segment': 'i was too frustrated to continue', 'sentiment': 'negative'}]"
"in the end our check came to $ 27 for 4 small pancakes , a breakfast burrito , an orange juice and an iced tea ( i had water ) .","['FOOD', 'FOOD', 'FOOD', 'DRINKS', 'DRINKS']","['STYLE_OPTIONS', 'PRICES', 'PRICES', 'PRICES', 'PRICES']","['0', '0', '0', '0', '0']","[{'category': 'Prices', 'aspect': 'Restaurant', 'segment': '$ 27 for 4 small pancakes , a breakfast burrito , an orange juice and an iced tea', 'sentiment': 'negative'}]"
much more than just a great view !,"['LOCATION', 'RESTAURANT']","['GENERAL', 'GENERAL']","['2', '2']","[{'category': 'General', 'aspect': 'Restaurant', 'segment': 'much more than just a great view', 'sentiment': 'positive'}]"
– i am exceedingly pleased to report that my dinner at ray ' s boathouse last friday completely exceeded my expectations .,['RESTAURANT'],['GENERAL'],['2'],"[{'category': 'General', 'aspect': 'Restaurant', 'segment': ""my dinner at ray ' s boathouse last friday completely exceeded my expectations"", 'sentiment': 'positive'}]"
"ray ' s is something of a seattle institution , but given its gorgeous sound views , i had suspected that the accolades were more due to the scenery than to the food and service .",['LOCATION'],['GENERAL'],['2'],"[{'category': 'General', 'aspect': 'Restaurant', 'segment': ""ray ' s is something of a seattle institution"", 'sentiment': 'neutral'}, {'category': 'General', 'aspect': 'Location', 'segment': 'gorgeous sound views', 'sentiment': 'positive'}, {'category': 'General', 'aspect': 'Food', 'segment': 'i had suspected that the accolades were more due to the scenery than to the food', 'sentiment': 'negative'}, {'category': 'General', 'aspect': 'Service', 'segment': 'i had suspected that the accolades were more due to the scenery than to the service', 'sentiment': 'negative'}]"
imagine my happy surprise upon finding that the views are only the third - best thing about ray ' s !,"['LOCATION', 'RESTAURANT']","['GENERAL', 'GENERAL']","['2', '2']","[{'category': 'General', 'aspect': 'Views', 'segment': 'the views are only the third - best thing', 'sentiment': 'neutral'}]"
"to start things off , our lovely server brooke was quickly on hand to take my drink order .","['SERVICE', 'SERVICE']","['GENERAL', 'GENERAL']","['2', '2']","[{'category': 'General', 'aspect': 'Service', 'segment': 'lovely server brooke was quickly on hand', 'sentiment': 'positive'}]"
"my party of two was feeling particularly ambitious , and we splurged on the shilshole sampler . . . a beautiful assortment of enormous white gulf prawns , smoked albacore tuna , ray ' s fantastic manila clams seasoned with dill , scallops in a tasty soy dressing , and a tiny pile of dungeness crab atop a sublime butter sauce .","['FOOD', 'FOOD', 'FOOD', 'FOOD']","['STYLE_OPTIONS', 'QUALITY', 'QUALITY', 'QUALITY']","['2', '2', '2', '2']","[{'category': 'Quality', 'aspect': 'Food', 'segment': 'enormous white gulf prawns', 'sentiment': 'positive'}, {'category': 'Quality', 'aspect': 'Food', 'segment': 'smoked albacore tuna', 'sentiment': 'positive'}, {'category': 'Quality', 'aspect': 'Food', 'segment': ""ray ' s fantastic manila clams seasoned with dill"", 'sentiment': 'positive'}, {'category': 'Quality', 'aspect': 'Food', 'segment': 'scallops in a tasty soy dressing', 'sentiment': 'positive'}, {'category': 'Quality', 'aspect': 'Food', 'segment': 'tiny pile of dungeness crab atop a sublime butter sauce', 'sentiment': 'positive'}]"
"for my entr & eacute ; e , i completely enjoyed the seared alaskan sea scallops complemented by chard , artichoke hearts , fennel , and pecorino toscano .","['FOOD', 'FOOD']","['QUALITY', 'STYLE_OPTIONS']","['2', '2']","[{'category': 'Quality', 'aspect': 'Food', 'segment': 'i completely enjoyed the seared alaskan sea scallops', 'sentiment': 'positive'}, {'category': 'Quality', 'aspect': 'Food', 'segment': 'complemented by chard , artichoke hearts , fennel , and pecorino toscano', 'sentiment': 'positive'}]"
the scallops are apparently cooked in a black olive butter which really makes them unique ( not to mention tasty ) .,"['FOOD', 'FOOD']","['QUALITY', 'STYLE_OPTIONS']","['2', '2']","[{'category': 'Quality', 'aspect': 'Food', 'segment': 'the scallops are apparently cooked in a black olive butter which really makes them unique', 'sentiment': 'positive'}, {'category': 'Quality', 'aspect': 'Food', 'segment': 'tasty', 'sentiment': 'positive'}]"
my friend enjoyed the grilled alaskan king salmon with delectable creamed washington russet potatoes and crisp green beans .,"['FOOD', 'FOOD', 'FOOD']","['QUALITY', 'QUALITY', 'QUALITY']","['2', '2', '2']","[{'category': 'Quality', 'aspect': 'Food', 'segment': 'grilled alaskan king salmon with delectable creamed washington russet potatoes and crisp green beans', 'sentiment': 'positive'}]"
"i had a taste of all three items on her plate , and they were superb .",['FOOD'],['QUALITY'],['2'],"[{'category': 'Quality', 'aspect': 'Food', 'segment': 'i had a taste of all three items on her plate , and they were superb', 'sentiment': 'positive'}]"
"our server continued to be attentive throughout the night , but i did remain puzzled by one issue : who thinks that ray ' s is an appropriate place to take young children for dinner ?","['SERVICE', 'RESTAURANT']","['GENERAL', 'MISCELLANEOUS']","['2', '1']","[{'category': 'General', 'aspect': 'Service', 'segment': 'our server continued to be attentive throughout the night', 'sentiment': 'positive'}, {'category': 'General', 'aspect': 'Restaurant', 'segment': ""i did remain puzzled by one issue : who thinks that ray ' s is an appropriate place to take young children for dinner ?"", 'sentiment': 'negative'}]"
"while i could have done without the youth who shared the evening with us , our wonderful server and food made the experience a very positive one .","['SERVICE', 'FOOD', 'RESTAURANT']","['GENERAL', 'QUALITY', 'MISCELLANEOUS']","['2', '2', '0']","[{'category': 'General', 'aspect': 'Service', 'segment': 'our wonderful server', 'sentiment': 'positive'}, {'category': 'Quality', 'aspect': 'Food', 'segment': 'food made the experience a very positive one', 'sentiment': 'positive'}, {'category': 'General', 'aspect': 'Restaurant', 'segment': 'i could have done without the youth who shared the evening with us', 'sentiment': 'negative'}]"
"oh yeah . . . the view was good , too .",['LOCATION'],['GENERAL'],['2'],"[{'category': 'General', 'aspect': 'View', 'segment': 'the view was good', 'sentiment': 'positive'}]"
yum !,['FOOD'],['QUALITY'],['2'],"[{'category': 'Quality', 'aspect': 'Food', 'segment': 'yum !', 'sentiment': 'positive'}]"
do n ' t leave the restaurant without it .,['FOOD'],['QUALITY'],['2'],"[{'category': 'General', 'aspect': 'Restaurant', 'segment': ""do n ' t leave the restaurant without it"", 'sentiment': 'positive'}]"
no comparison,['RESTAURANT'],['GENERAL'],['2'],"[{'category': 'General', 'aspect': 'Restaurant', 'segment': ""no comparison to the other places we ' ve been to"", 'sentiment': 'negative'}]"
– i ca n ' t say enough about this place .,['RESTAURANT'],['GENERAL'],['2'],"[{'category': 'General', 'aspect': 'Restaurant', 'segment': ""i ca n ' t say enough about this place"", 'sentiment': 'positive'}]"
snotty attitude,['SERVICE'],['GENERAL'],['0'],"[{'category': 'General', 'aspect': 'Service', 'segment': 'snotty attitude from the hostess', 'sentiment': 'negative'}]"
– we were treated very rudely here one time for breakfast .,['SERVICE'],['GENERAL'],['0'],"[{'category': 'General', 'aspect': 'Service', 'segment': 'we were treated very rudely', 'sentiment': 'negative'}]"
we never had to wait more than 5 minutes .,['SERVICE'],['GENERAL'],['2'],"[{'category': 'General', 'aspect': 'Service', 'segment': 'we never had to wait more than 5 minutes', 'sentiment': 'positive'}]"
they are not greasy or anything .,['FOOD'],['QUALITY'],['2'],"[{'category': 'Quality', 'aspect': 'Food', 'segment': 'they are not greasy or anything', 'sentiment': 'positive'}]"
overrated,['RESTAURANT'],['GENERAL'],['0'],"[{'category': 'General', 'aspect': 'Restaurant', 'segment': 'overrated', 'sentiment': 'negative'}, {'category': 'Prices', 'aspect': 'Restaurant', 'segment': 'not worth the money', 'sentiment': 'negative'}]"
– i was highly disappointed in the food at pagoda .,['FOOD'],['QUALITY'],['0'],"[{'category': 'Quality', 'aspect': 'Food', 'segment': 'i was highly disappointed in the food', 'sentiment': 'negative'}]"
i will not go back .,['RESTAURANT'],['GENERAL'],['0'],"[{'category': 'General', 'aspect': 'Restaurant', 'segment': 'i will not go back', 'sentiment': 'negative'}]"
i will never return again .,['RESTAURANT'],['GENERAL'],['0'],"[{'category': 'General', 'aspect': 'Restaurant', 'segment': 'i will never return again', 'sentiment': 'negative'}]"
it was absolutely amazing .,['RESTAURANT'],['GENERAL'],['2'],"[{'category': 'General', 'aspect': 'Restaurant', 'segment': 'it was absolutely amazing', 'sentiment': 'positive'}]"
amazing .,['RESTAURANT'],['GENERAL'],['2'],"[{'category': 'General', 'aspect': 'Restaurant', 'segment': 'amazing', 'sentiment': 'positive'}]"
i can not wait to go back again this coming weekend !,['RESTAURANT'],['GENERAL'],['2'],"[{'category': 'General', 'aspect': 'Restaurant', 'segment': 'i can not wait to go back again this coming weekend', 'sentiment': 'positive'}]"
mmm . . . good !,['RESTAURANT'],['GENERAL'],['2'],"[{'category': 'Quality', 'aspect': 'Food', 'segment': 'mmm . . . good !', 'sentiment': 'positive'}]"
we ' re going back . : d,['RESTAURANT'],['GENERAL'],['2'],"[{'category': 'General', 'aspect': 'Restaurant', 'segment': ""we're going back"", 'sentiment': 'positive'}]"
finally a meal that you will remember for a long time !,['FOOD'],['QUALITY'],['2'],"[{'category': 'Quality', 'aspect': 'Food', 'segment': 'finally a meal that you will remember for a long time', 'sentiment': 'positive'}]"
very disappointing,['RESTAURANT'],['GENERAL'],['0'],"[{'category': 'General', 'aspect': 'Restaurant', 'segment': 'very disappointing', 'sentiment': 'negative'}]"
– i took my parents here for their anniversary - very very disappointed ! ! !,['RESTAURANT'],['GENERAL'],['0'],"[{'category': 'General', 'aspect': 'Restaurant', 'segment': 'very very disappointed', 'sentiment': 'negative'}]"
nothing really came across as outstanding .,['FOOD'],['QUALITY'],['0'],"[{'category': 'General', 'aspect': 'Restaurant', 'segment': 'nothing really came across as outstanding', 'sentiment': 'negative'}]"
very disappointed .,['RESTAURANT'],['GENERAL'],['0'],"[{'category': 'General', 'aspect': 'Restaurant', 'segment': 'very disappointed', 'sentiment': 'negative'}]"
we were then charged for their most expensive sake ( $ 20 + per serving ) when we in fact drank a sake of less than half that price .,['SERVICE'],['GENERAL'],['0'],"[{'category': 'Prices', 'aspect': 'Drinks', 'segment': 'we were then charged for their most expensive sake ( $ 20 + per serving )', 'sentiment': 'negative'}, {'category': 'Quality', 'aspect': 'Drinks', 'segment': 'we drank a sake of less than half that price', 'sentiment': 'positive'}]"
you are bound to have a very charming time .,['RESTAURANT'],['GENERAL'],['2'],"[{'category': 'General', 'aspect': 'Restaurant', 'segment': 'you are bound to have a very charming time', 'sentiment': 'positive'}]"
not recommanded ! ! !,['RESTAURANT'],['GENERAL'],['0'],"[{'category': 'General', 'aspect': 'Restaurant', 'segment': 'not recommanded ! ! !', 'sentiment': 'negative'}]"
