text,term_true,cat_true,pol_true,analysis
"i would normally not finish the brocolli when i order these kinds of food but for the first time , every piece was as eventful as the first one . . . the scallops and prawns was so fresh and nicely cooked .","['FOOD', 'FOOD', 'FOOD', 'FOOD', 'FOOD']","['QUALITY', 'QUALITY', 'QUALITY', 'QUALITY', 'QUALITY']","['2', '2', '2', '2', '2']","[{'category': 'Quality', 'aspect': 'Food', 'segment': 'every piece was as eventful as the first one', 'sentiment': 'positive'}, {'category': 'Quality', 'aspect': 'Food', 'segment': 'the scallops and prawns was so fresh and nicely cooked', 'sentiment': 'positive'}]"
chintzy portions,['FOOD'],['STYLE_OPTIONS'],['0'],"[{'category': 'Quantity', 'aspect': 'Food', 'segment': 'chintzy portions for the price', 'sentiment': 'negative'}]"
"– the sushi here is perfectly good , but for $ 5 a piece , either the slices of fish should be larger , or there should be no pretense that this is a moderately priced restaurant ( even for nyc ) .","['FOOD', 'FOOD', 'FOOD', 'RESTAURANT']","['QUALITY', 'STYLE_OPTIONS', 'PRICES', 'PRICES']","['0', '0', '0', '0']","[{'category': 'Quality', 'aspect': 'Food', 'segment': 'the sushi here is perfectly good', 'sentiment': 'positive'}, {'category': 'Prices', 'aspect': 'Food', 'segment': '$ 5 a piece', 'sentiment': 'negative'}, {'category': 'Prices', 'aspect': 'Restaurant', 'segment': 'moderately priced restaurant', 'sentiment': 'negative'}]"
"terrible service , food ok , pricey","['SERVICE', 'FOOD', 'RESTAURANT']","['GENERAL', 'QUALITY', 'PRICES']","['0', '1', '0']","[{'category': 'General', 'aspect': 'Service', 'segment': 'terrible service', 'sentiment': 'negative'}, {'category': 'Quality', 'aspect': 'Food', 'segment': 'food ok', 'sentiment': 'neutral'}, {'category': 'Prices', 'aspect': 'Restaurant', 'segment': 'pricey', 'sentiment': 'negative'}]"
"food wise , its ok but a bit pricey for what you get considering the restaurant is n ' t a fancy place .","['FOOD', 'FOOD', 'AMBIENCE']","['QUALITY', 'PRICES', 'GENERAL']","['1', '0', '1']","[{'category': 'Quality', 'aspect': 'Food', 'segment': 'food wise , its ok', 'sentiment': 'neutral'}, {'category': 'Prices', 'aspect': 'Food', 'segment': ""a bit pricey for what you get considering the restaurant is n ' t a fancy place"", 'sentiment': 'negative'}]"
if i needed to name some they would include the location to the beach or golden gate park .,['LOCATION'],['GENERAL'],['0'],"[{'category': 'General', 'aspect': 'Location', 'segment': 'location to the beach', 'sentiment': 'positive'}, {'category': 'General', 'aspect': 'Location', 'segment': 'golden gate park', 'sentiment': 'positive'}]"
another plus is the open feel of the restaurant with glass walls on all sides .,['AMBIENCE'],['GENERAL'],['2'],"[{'category': 'General', 'aspect': 'Ambience', 'segment': 'open feel of the restaurant with glass walls on all sides', 'sentiment': 'positive'}]"
amazing spanish mackeral special appetizer and perfect box sushi ( that eel with avodcao - - um um um ) .,"['FOOD', 'FOOD', 'FOOD']","['QUALITY', 'QUALITY', 'QUALITY']","['2', '2', '2']","[{'category': 'Quality', 'aspect': 'Food', 'segment': 'amazing spanish mackeral special appetizer', 'sentiment': 'positive'}, {'category': 'Quality', 'aspect': 'Food', 'segment': 'perfect box sushi', 'sentiment': 'positive'}]"
"as usual the omikase did n ' t disappoint in freshness , although it scored low on creativity and selection .","['FOOD', 'FOOD']","['QUALITY', 'STYLE_OPTIONS']","['2', '0']","[{'category': 'Quality', 'aspect': 'Food', 'segment': ""omikase did n ' t disappoint in freshness"", 'sentiment': 'positive'}, {'category': 'Creativity', 'aspect': 'Food', 'segment': 'scored low on creativity', 'sentiment': 'negative'}, {'category': 'Style_Options', 'aspect': 'Food', 'segment': 'scored low on selection', 'sentiment': 'negative'}]"
"their specialty rolls are impressive , though i ca n ' t remember what we had .",['FOOD'],['QUALITY'],['2'],"[{'category': 'Quality', 'aspect': 'Food', 'segment': 'specialty rolls are impressive', 'sentiment': 'positive'}, {'category': 'Quality', 'aspect': 'Food', 'segment': ""i ca n ' t remember what we had"", 'sentiment': 'neutral'}]"
green tea creme brulee gets better each time i have it .,['FOOD'],['QUALITY'],['2'],"[{'category': 'Quality', 'aspect': 'Food', 'segment': 'green tea creme brulee gets better each time i have it', 'sentiment': 'positive'}]"
great selection of sakes .,['DRINKS'],['STYLE_OPTIONS'],['2'],"[{'category': 'Style_Options', 'aspect': 'Drinks', 'segment': 'great selection of sakes', 'sentiment': 'positive'}]"
it is n ' t the cheapest sushi but has been worth it every time .,"['FOOD', 'FOOD']","['PRICES', 'QUALITY']","['1', '2']","[{'category': 'Prices', 'aspect': 'Food', 'segment': ""isn ' t the cheapest sushi"", 'sentiment': 'negative'}, {'category': 'Quality', 'aspect': 'Food', 'segment': 'has been worth it every time', 'sentiment': 'positive'}]"
very poor customer service .,['SERVICE'],['GENERAL'],['0'],"[{'category': 'General', 'aspect': 'Service', 'segment': 'very poor customer service', 'sentiment': 'negative'}]"
"– schooner or later ' s charming location along the marina in long beach and average food does not , unfortunately , compensate for its very poor customer service .","['LOCATION', 'FOOD', 'SERVICE']","['GENERAL', 'QUALITY', 'GENERAL']","['2', '1', '0']","[{'category': 'General', 'aspect': 'Location', 'segment': 'charming location along the marina in long beach', 'sentiment': 'positive'}, {'category': 'Quality', 'aspect': 'Food', 'segment': 'average food', 'sentiment': 'neutral'}, {'category': 'General', 'aspect': 'Service', 'segment': 'very poor customer service', 'sentiment': 'negative'}]"
"while this diner had reasonably good food , the restaurant staff seemed completely indifferent to our presence , and this attitude was reflected in the lack of service .","['FOOD', 'SERVICE']","['QUALITY', 'GENERAL']","['2', '0']","[{'category': 'Quality', 'aspect': 'Food', 'segment': 'reasonably good food', 'sentiment': 'positive'}, {'category': 'General', 'aspect': 'Service', 'segment': 'restaurant staff seemed completely indifferent to our presence', 'sentiment': 'negative'}, {'category': 'General', 'aspect': 'Service', 'segment': 'lack of service', 'sentiment': 'negative'}]"
"the fish was fresh , though it was cut very thin .","['FOOD', 'FOOD']","['QUALITY', 'QUALITY']","['2', '0']","[{'category': 'Quality', 'aspect': 'Food', 'segment': 'the fish was fresh', 'sentiment': 'positive'}, {'category': 'Quality', 'aspect': 'Food', 'segment': 'the fish was cut very thin', 'sentiment': 'neutral'}]"
great service .,['SERVICE'],['GENERAL'],['2'],"[{'category': 'General', 'aspect': 'Service', 'segment': 'great service', 'sentiment': 'positive'}]"
good sake selection .,['DRINKS'],['STYLE_OPTIONS'],['2'],"[{'category': 'Style_Options', 'aspect': 'Drinks', 'segment': 'good sake selection', 'sentiment': 'positive'}]"
dungeness crabs here !,['FOOD'],['QUALITY'],['2'],"[{'category': 'Style_Options', 'aspect': 'Food', 'segment': 'dungeness crabs here !', 'sentiment': 'positive'}]"
– ray ' s is the place to go for high quality seafood dinners .,['FOOD'],['QUALITY'],['2'],"[{'category': 'Quality', 'aspect': 'Food', 'segment': 'high quality seafood dinners', 'sentiment': 'positive'}]"
i love dungeness crabs and at ray ' s you can get them served in about 6 different ways !,['FOOD'],['STYLE_OPTIONS'],['2'],"[{'category': 'Quality', 'aspect': 'Food', 'segment': ""i love dungeness crabs and at ray ' s you can get them served in about 6 different ways !"", 'sentiment': 'positive'}]"
we shared the family platter and i especially enjoyed the black cod in sake kasu .,['FOOD'],['QUALITY'],['2'],"[{'category': 'Quality', 'aspect': 'Food', 'segment': 'i especially enjoyed the black cod in sake kasu', 'sentiment': 'positive'}]"
i ended the meal with the unusual dessert of a port and chocolate tasting . . . . yummy !,"['FOOD', 'FOOD']","['QUALITY', 'QUALITY']","['2', '2']","[{'category': 'Quality', 'aspect': 'Food', 'segment': 'i ended the meal with the unusual dessert of a port and chocolate tasting . . . . yummy !', 'sentiment': 'positive'}]"
and the service was simply spendid - quite a delight .,"['SERVICE', 'SERVICE']","['GENERAL', 'GENERAL']","['2', '2']","[{'category': 'General', 'aspect': 'Service', 'segment': 'the service was simply spendid', 'sentiment': 'positive'}]"
"– great drinks , corn beef hash , coffee , b fast burritos , gluten free menu .","['DRINKS', 'FOOD', 'DRINKS', 'FOOD', 'FOOD']","['QUALITY', 'QUALITY', 'QUALITY', 'QUALITY', 'STYLE_OPTIONS']","['2', '2', '2', '2', '2']","[{'category': 'Quality', 'aspect': 'Drinks', 'segment': 'great drinks', 'sentiment': 'positive'}, {'category': 'Quality', 'aspect': 'Food', 'segment': 'corn beef hash', 'sentiment': 'positive'}, {'category': 'Quality', 'aspect': 'Food', 'segment': 'coffee', 'sentiment': 'positive'}, {'category': 'Quality', 'aspect': 'Food', 'segment': 'b fast burritos', 'sentiment': 'positive'}, {'category': 'Style_Options', 'aspect': 'Food', 'segment': 'gluten free menu', 'sentiment': 'positive'}]"
the service is fantastic at this fun place .,"['SERVICE', 'RESTAURANT']","['GENERAL', 'GENERAL']","['2', '2']","[{'category': 'General', 'aspect': 'Service', 'segment': 'the service is fantastic', 'sentiment': 'positive'}]"
"if there is a line very day of the week for the entire time a place is open , you know it is great .",['RESTAURANT'],['GENERAL'],['2'],"[{'category': 'General', 'aspect': 'Restaurant', 'segment': 'if there is a line very day of the week for the entire time a place is open , you know it is great', 'sentiment': 'positive'}]"
best neighborhood standby .,['RESTAURANT'],['GENERAL'],['2'],"[{'category': 'General', 'aspect': 'Restaurant', 'segment': 'best neighborhood standby', 'sentiment': 'positive'}]"
in grammercy / union square / east village this is my neighbors and my favorite spot .,['RESTAURANT'],['GENERAL'],['2'],"[{'category': 'General', 'aspect': 'Location', 'segment': 'in grammercy / union square / east village', 'sentiment': 'positive'}, {'category': 'General', 'aspect': 'Restaurant', 'segment': 'this is my neighbors and my favorite spot', 'sentiment': 'positive'}]"
"the music is great , no night better or worse , the bar tenders are generous with the pouring , and the lighthearted atmosphere will lifts you spirits .","['AMBIENCE', 'DRINKS', 'AMBIENCE']","['GENERAL', 'STYLE_OPTIONS', 'GENERAL']","['2', '2', '2']","[{'category': 'General', 'aspect': 'Atmosphere', 'segment': 'the music is great', 'sentiment': 'positive'}, {'category': 'General', 'aspect': 'Atmosphere', 'segment': 'no night better or worse', 'sentiment': 'positive'}, {'category': 'General', 'aspect': 'Atmosphere', 'segment': 'the bar tenders are generous with the pouring', 'sentiment': 'positive'}, {'category': 'General', 'aspect': 'Atmosphere', 'segment': 'lighthearted atmosphere will lifts you spirits', 'sentiment': 'positive'}]"
"oh , and the cheese fries are awesome !",['FOOD'],['QUALITY'],['2'],"[{'category': 'Quality', 'aspect': 'Food', 'segment': 'the cheese fries are awesome', 'sentiment': 'positive'}]"
"good food , great service , average prices ( for the strip )","['FOOD', 'SERVICE', 'RESTAURANT']","['QUALITY', 'GENERAL', 'PRICES']","['2', '2', '1']","[{'category': 'Quality', 'aspect': 'Food', 'segment': 'good food', 'sentiment': 'positive'}, {'category': 'General', 'aspect': 'Service', 'segment': 'great service', 'sentiment': 'positive'}, {'category': 'Prices', 'aspect': 'Restaurant', 'segment': 'average prices', 'sentiment': 'neutral'}]"
"when i walked in , i was taken aback by their incredible wood decor .",['AMBIENCE'],['GENERAL'],['2'],"[{'category': 'General', 'aspect': 'Ambience', 'segment': 'incredible wood decor', 'sentiment': 'positive'}]"
"the music playing was very hip , 20 - 30 something pop music , but the subwoofer to the sound system was located under my seat , which became annoying midway through dinner .","['AMBIENCE', 'AMBIENCE']","['GENERAL', 'GENERAL']","['2', '0']","[{'category': 'General', 'aspect': 'Ambience', 'segment': 'the music playing was very hip , 20 - 30 something pop music', 'sentiment': 'positive'}, {'category': 'General', 'aspect': 'Ambience', 'segment': 'subwoofer to the sound system was located under my seat , which became annoying midway through dinner', 'sentiment': 'negative'}]"
i got the shellfish and shrimp appetizer and it was alright .,['FOOD'],['QUALITY'],['1'],"[{'category': 'Quality', 'aspect': 'Food', 'segment': 'i got the shellfish and shrimp appetizer and it was alright', 'sentiment': 'neutral'}]"
"it was n ' t the freshest seafood ever , but the taste and presentation was ok .","['FOOD', 'FOOD']","['STYLE_OPTIONS', 'QUALITY']","['1', '1']","[{'category': 'Quality', 'aspect': 'Food', 'segment': ""it was n't the freshest seafood ever"", 'sentiment': 'negative'}, {'category': 'Quality', 'aspect': 'Food', 'segment': 'taste and presentation was ok', 'sentiment': 'positive'}]"
"i picked the asparagus , which turned out to be incredible and perfectly prepared .","['FOOD', 'FOOD']","['QUALITY', 'QUALITY']","['2', '2']","[{'category': 'Quality', 'aspect': 'Food', 'segment': 'asparagus was incredible and perfectly prepared', 'sentiment': 'positive'}]"
"the 9 oz steak came next and it tasted great , at least initially .",['FOOD'],['QUALITY'],['2'],"[{'category': 'Quality', 'aspect': 'Food', 'segment': 'the 9 oz steak came next and it tasted great', 'sentiment': 'positive'}, {'category': 'Quality', 'aspect': 'Food', 'segment': 'at least initially', 'sentiment': 'positive'}]"
the steak was done to my exact liking ( medium rare ) and was nice and juicy .,"['FOOD', 'FOOD']","['QUALITY', 'QUALITY']","['2', '2']","[{'category': 'Quality', 'aspect': 'Food', 'segment': 'the steak was done to my exact liking ( medium rare ) and was nice and juicy', 'sentiment': 'positive'}]"
"it ? s served with either a peppercorn sauce or red wine reduction , though both were indistinguishable in taste .","['FOOD', 'FOOD']","['QUALITY', 'QUALITY']","['1', '1']","[{'category': 'Quality', 'aspect': 'Food', 'segment': 'peppercorn sauce or red wine reduction , though both were indistinguishable in taste', 'sentiment': 'negative'}]"
"though , one thing i realized later on was that the restaurant either used msg or a meat tenderizer on the steak .",['FOOD'],['QUALITY'],['0'],"[{'category': 'Quality', 'aspect': 'Food', 'segment': 'the restaurant either used msg or a meat tenderizer on the steak', 'sentiment': 'negative'}]"
the desert was the perfect ending to an almost perfect dinner .,"['FOOD', 'FOOD']","['QUALITY', 'QUALITY']","['2', '2']","[{'category': 'Quality', 'aspect': 'Food', 'segment': 'the desert was the perfect ending to an almost perfect dinner', 'sentiment': 'positive'}]"
"overall , i would go back and eat at the restaurant again .",['RESTAURANT'],['GENERAL'],['2'],"[{'category': 'General', 'aspect': 'Restaurant', 'segment': 'overall', 'sentiment': 'positive'}]"
but the servers were extremely attentive and very friendly .,"['SERVICE', 'SERVICE']","['GENERAL', 'GENERAL']","['2', '2']","[{'category': 'General', 'aspect': 'Service', 'segment': 'the servers were extremely attentive', 'sentiment': 'positive'}, {'category': 'General', 'aspect': 'Service', 'segment': 'very friendly', 'sentiment': 'positive'}]"
"good sake , good food – i honestly do n ' t know much about japanese food at all .","['DRINKS', 'FOOD']","['QUALITY', 'QUALITY']","['2', '2']","[{'category': 'Quality', 'aspect': 'Drinks', 'segment': 'good sake', 'sentiment': 'positive'}, {'category': 'Quality', 'aspect': 'Food', 'segment': 'good food', 'sentiment': 'positive'}]"
server made several sake suggestions which were very good .,"['DRINKS', 'SERVICE']","['QUALITY', 'GENERAL']","['2', '2']","[{'category': 'General', 'aspect': 'Service', 'segment': 'server made several sake suggestions', 'sentiment': 'positive'}, {'category': 'Quality', 'aspect': 'Drinks', 'segment': 'sake suggestions were very good', 'sentiment': 'positive'}]"
had many dishes but the best was the lobster 3 ways .,['FOOD'],['QUALITY'],['2'],"[{'category': 'Quality', 'aspect': 'Food', 'segment': 'lobster 3 ways', 'sentiment': 'positive'}]"
the waiter was a bit unfriendly and the feel of the restaurant was crowded .,"['SERVICE', 'AMBIENCE']","['GENERAL', 'GENERAL']","['0', '0']","[{'category': 'General', 'aspect': 'Service', 'segment': 'the waiter was a bit unfriendly', 'sentiment': 'negative'}, {'category': 'General', 'aspect': 'Ambience', 'segment': 'the feel of the restaurant was crowded', 'sentiment': 'negative'}]"
"also , there was only one bathroom stall - probably need more for such big crowds .",['RESTAURANT'],['MISCELLANEOUS'],['2'],"[{'category': 'General', 'aspect': 'Restaurant', 'segment': 'one bathroom stall', 'sentiment': 'negative'}]"
"most importantly , we were so excited about the food after seeing the very creative menu .",['FOOD'],['STYLE_OPTIONS'],['2'],"[{'category': 'Quality', 'aspect': 'Food', 'segment': 'we were so excited about the food after seeing the very creative menu', 'sentiment': 'positive'}]"
"at best , the food was good and definately overpriced .","['FOOD', 'FOOD']","['QUALITY', 'QUALITY']","['2', '0']","[{'category': 'Quality', 'aspect': 'Food', 'segment': 'the food was good', 'sentiment': 'positive'}, {'category': 'Prices', 'aspect': 'Food', 'segment': 'definately overpriced', 'sentiment': 'negative'}]"
for the amount of food we got the prices should have been lower .,"['FOOD', 'FOOD']","['PRICES', 'STYLE_OPTIONS']","['0', '0']","[{'category': 'Prices', 'aspect': 'Food', 'segment': 'for the amount of food we got the prices should have been lower', 'sentiment': 'negative'}]"
my favortie pizza joint in seattle,['RESTAURANT'],['GENERAL'],['2'],"[{'category': 'General', 'aspect': 'Pizza', 'segment': 'my favortie pizza joint in seattle', 'sentiment': 'positive'}]"
– this is my ` ` must bring out of town guests to ' ' restaurant and they always enjoy and rave about it .,"['RESTAURANT', 'RESTAURANT']","['GENERAL', 'GENERAL']","['2', '2']","[{'category': 'General', 'aspect': 'Restaurant', 'segment': ""my ` ` must bring out of town guests to ' ' restaurant"", 'sentiment': 'positive'}, {'category': 'General', 'aspect': 'Restaurant', 'segment': 'they always enjoy and rave about it', 'sentiment': 'positive'}]"
the pizza is delicious and the salads are fantastic .,"['FOOD', 'FOOD']","['QUALITY', 'QUALITY']","['2', '2']","[{'category': 'Quality', 'aspect': 'Food', 'segment': 'pizza is delicious', 'sentiment': 'positive'}, {'category': 'Quality', 'aspect': 'Food', 'segment': 'salads are fantastic', 'sentiment': 'positive'}]"
"i ' ve always found the wait staff and , if you sit at the bar , the cooks very friendly .","['SERVICE', 'SERVICE']","['GENERAL', 'GENERAL']","['2', '2']","[{'category': 'General', 'aspect': 'Service', 'segment': 'the wait staff', 'sentiment': 'positive'}, {'category': 'General', 'aspect': 'Service', 'segment': 'the cooks', 'sentiment': 'positive'}]"
i also really enjoy the simplicity of the decor and intimate feeling of a small restaurant .,"['AMBIENCE', 'AMBIENCE', 'AMBIENCE']","['GENERAL', 'GENERAL', 'GENERAL']","['2', '2', '2']","[{'category': 'General', 'aspect': 'Ambience', 'segment': 'the simplicity of the decor', 'sentiment': 'positive'}, {'category': 'General', 'aspect': 'Ambience', 'segment': 'the intimate feeling of a small restaurant', 'sentiment': 'positive'}]"
– my husband and i love eating at mioposto cafe .,['RESTAURANT'],['GENERAL'],['2'],"[{'category': 'General', 'aspect': 'Restaurant', 'segment': 'my husband and i love eating at mioposto cafe', 'sentiment': 'positive'}]"
we ' re ca n ' t say enough about their delicious gourmet pizza ’ s !,['FOOD'],['QUALITY'],['2'],"[{'category': 'Quality', 'aspect': 'Food', 'segment': ""we ' re ca n ' t say enough about their delicious gourmet pizza ’ s !"", 'sentiment': 'positive'}]"
you won ’ t be disappointed by their menu .,['FOOD'],['STYLE_OPTIONS'],['2'],"[{'category': 'Quality', 'aspect': 'Food', 'segment': ""you won't be disappointed by their menu"", 'sentiment': 'positive'}]"
the pizza ' s are thin crust and the menu offers very creative combinations and toppings .,"['FOOD', 'FOOD']","['STYLE_OPTIONS', 'STYLE_OPTIONS']","['2', '2']","[{'category': 'Style_Options', 'aspect': 'Food', 'segment': ""pizza ' s are thin crust"", 'sentiment': 'positive'}, {'category': 'Style_Options', 'aspect': 'Food', 'segment': 'menu offers very creative combinations and toppings', 'sentiment': 'positive'}]"
try the pizza ensalata !,['FOOD'],['QUALITY'],['2'],"[{'category': 'Recommendation', 'aspect': 'Food', 'segment': 'try the pizza ensalata', 'sentiment': 'positive'}]"
the pizza ' s are not huge and the crust is thin … keep that in mind when you ’ re ordering .,"['FOOD', 'FOOD']","['STYLE_OPTIONS', 'STYLE_OPTIONS']","['2', '2']","[{'category': 'Style_Options', 'aspect': 'Food', 'segment': ""pizza ' s are not huge"", 'sentiment': 'negative'}, {'category': 'Style_Options', 'aspect': 'Food', 'segment': 'crust is thin', 'sentiment': 'negative'}]"
the food is sinful .,['FOOD'],['QUALITY'],['2'],"[{'category': 'Quality', 'aspect': 'Food', 'segment': 'the food is sinful', 'sentiment': 'positive'}]"
the staff was really friendly .,['SERVICE'],['GENERAL'],['2'],"[{'category': 'General', 'aspect': 'Service', 'segment': 'the staff was really friendly', 'sentiment': 'positive'}]"
the atmosphere was great .,['AMBIENCE'],['GENERAL'],['2'],"[{'category': 'General', 'aspect': 'Ambience', 'segment': 'the atmosphere was great', 'sentiment': 'positive'}]"
"the specialty here is decadent pancakes , but i ' ve been back now four times , and i ' ve been wowed every time .",['FOOD'],['QUALITY'],['2'],"[{'category': 'Quality', 'aspect': 'Food', 'segment': 'the specialty here is decadent pancakes', 'sentiment': 'positive'}, {'category': 'Quality', 'aspect': 'Food', 'segment': ""i ' ve been wowed every time"", 'sentiment': 'positive'}]"
nothing on the menu is less than amazing .,['FOOD'],['QUALITY'],['2'],"[{'category': 'Quality', 'aspect': 'Food', 'segment': 'nothing on the menu is less than amazing', 'sentiment': 'positive'}]"
good eats .,['FOOD'],['QUALITY'],['2'],"[{'category': 'Quality', 'aspect': 'Food', 'segment': 'good eats', 'sentiment': 'positive'}]"
"i have been to this place , folks and it is bad .",['RESTAURANT'],['GENERAL'],['0'],"[{'category': 'General', 'aspect': 'Restaurant', 'segment': 'i have been to this place , folks and it is bad', 'sentiment': 'negative'}]"
maybe it is good for that one night once in a blue moon when the chefs decide to use fish that ' s half - way decent .,['FOOD'],['QUALITY'],['0'],"[{'category': 'Quality', 'aspect': 'Food', 'segment': ""maybe it is good for that one night once in a blue moon when the chefs decide to use fish that ' s half - way decent"", 'sentiment': 'neutral'}]"
"i have been here , spent tons of money on a chef special dinner and it was a major dissappointment .","['FOOD', 'FOOD']","['QUALITY', 'PRICES']","['0', '0']","[{'category': 'Quality', 'aspect': 'Food', 'segment': 'major dissappointment', 'sentiment': 'negative'}]"
– the atmosphere is great for any special occasion you might want to celebrate .,['AMBIENCE'],['GENERAL'],['2'],"[{'category': 'General', 'aspect': 'Ambience', 'segment': 'atmosphere is great for any special occasion', 'sentiment': 'positive'}]"
the best dish are the honwy walnut prawns - just outstanding .,"['FOOD', 'FOOD']","['QUALITY', 'QUALITY']","['2', '2']","[{'category': 'Quality', 'aspect': 'Food', 'segment': 'the best dish are the honwy walnut prawns', 'sentiment': 'positive'}]"
fancy pieces of exotic fish on a $ 100 dollar plate and not one was eatable .,"['FOOD', 'FOOD', 'FOOD']","['QUALITY', 'STYLE_OPTIONS', 'PRICES']","['0', '0', '0']","[{'category': 'Quality', 'aspect': 'Food', 'segment': 'fancy pieces of exotic fish on a $ 100 dollar plate and not one was eatable', 'sentiment': 'negative'}]"
the service is really attentive and charming .,"['SERVICE', 'SERVICE']","['GENERAL', 'GENERAL']","['2', '2']","[{'category': 'General', 'aspect': 'Service', 'segment': 'the service is really attentive', 'sentiment': 'positive'}, {'category': 'General', 'aspect': 'Service', 'segment': 'the service is charming', 'sentiment': 'positive'}]"
"the service was excellent , the coffee was good even by starbucks standards and the food was outstanding .","['SERVICE', 'DRINKS', 'FOOD']","['GENERAL', 'QUALITY', 'QUALITY']","['2', '2', '2']","[{'category': 'General', 'aspect': 'Service', 'segment': 'the service was excellent', 'sentiment': 'positive'}, {'category': 'Quality', 'aspect': 'Coffee', 'segment': 'the coffee was good even by starbucks standards', 'sentiment': 'positive'}, {'category': 'Quality', 'aspect': 'Food', 'segment': 'the food was outstanding', 'sentiment': 'positive'}]"
– i recently had the pleasure of dining as this delightful restaurant on 2nd street and wow what a great evening we had .,['RESTAURANT'],['GENERAL'],['2'],"[{'category': 'General', 'aspect': 'Restaurant', 'segment': 'i recently had the pleasure of dining as this delightful restaurant', 'sentiment': 'positive'}, {'category': 'General', 'aspect': 'Restaurant', 'segment': 'wow what a great evening we had', 'sentiment': 'positive'}]"
