category,aspect,segment,sentiment,review_id
Operation_Performance,Battery,the battery lasts at least 8 - 9 hours,positive,809
Operation_Performance,Battery,making it perfect for students,positive,809
Operation_Performance,CPU,it is quick,positive,810
Design_Features,Battery,battery lasts a long time,positive,810
Operation_Performance,Web_Browsing,web surfing multiple pages at the same time while having a few ms documents open,positive,810
Operation_Performance,Switch,the switch has been awesome,positive,812
Design_Features,Keyboard,the backlit keyboard,positive,813
Design_Features,Keyboard,is awesome at night,positive,813
Design_Features,Keyboard,keyboard was a little confusing,negative,814
Design_Features,Screen,screen display is bright,positive,815
Design_Features,Graphics,has excellent graphics,positive,815
