category,aspect,segment,sentiment,review_id
Operation_Performance,CPU,the quad - core celeron n3160 gets a respectable near - 8000 octane score,positive,266
Design_Features,Design,"This is a solid, well-balanced design.",positive,267
Operation_Performance,Chromebook,has worked for all these tasks,positive,269
Operation_Performance,Software,"as for software, chromeos is a decent thin-client operating system which can do more than most people think",positive,270
Price,Price,because of the price,negative,271
Design_Features,Machine,this is honestly an amazing machine,positive,271
Design_Features,Machine,this is a really aesthetically pleasing machine,positive,272
Operation_Performance,growth opportunities,several growth opportunities,positive,273
Design_Features,Trackpad,the trackpad feels a bit delicate,negative,274
Use,emails,to check emails,positive,276
Use,movies,to watch movies,positive,276
Use,shopping,to shop,positive,276
Use,documentation,for basic documentation,positive,276
Q&A,Chromebook,i have had q & a on this chromebook asking if it will download ms office,neutral,277
Design_Features,Battery,battery seems to be pretty good,positive,278
Operation_Performance,CPU,with the slow celeron processor,negative,279
Operation_Performance,Browsing,browsing does not feel snappy,negative,279
Design_Features,Chromebook,"This is my second Chromebook, ",positive,280
Design_Features,Chromebase,my next purchase will be a Chromebase to replace my home pc.,positive,280
Operation_Performance,Laptop,it does everything that i need and is surprisingly fast,positive,281
Operation_Performance,Google Play Store,this doesn ' t support google play store,negative,282
Operation_Performance,Creative Software,my creative software operates with no problems,positive,283
Operation_Performance,Games,i'm able to play the sims 4 and world of warcraft on very high settings with no problems at all,positive,283
Storage,Drives,drives are now solid state drive,positive,285
Design_Features,Speakers,new built - in speakers,positive,286
Design_Features,DVD Drive,no dvd drive,negative,287
Design_Features,Screen,very sharp screen,positive,290
Design_Features,Screen,good viewing angles,positive,290
Design_Features,OS X,something about os x running with a high resolution display just looks classy in a way that a windows computer could never match,positive,291
none,none,no complaints here,positive,292
Operation_Performance,CPU,this computer is blazing fast,positive,293
Design_Features,OS,with os x yosemite,positive,294
Design_Features,OS,the os is very refined and elegant,positive,294
Operation_Performance,Laptop,the laptop works great,positive,295
Design_Features,Package,package was delivered on time,positive,295
Operation_Performance,CPU,this thing is fast,positive,296
Operation_Performance,CPU,and efficient,positive,296
Quality,Computer,this computer is very high quality,positive,297
Quality,Market,do not believe anything on the market can touch it,negative,297
Design_Features,Backlighting,the backlighting is comparable,positive,298
Design_Features,Brightness,the mbp gets brighter,positive,298
Design_Features,Thunderbolt ports,the thunderbolt ports are a nice thing to have on the mbp,positive,299
Purchase,Grandson,bought it for my grandson for college,positive,301
General,Laptop,and he loves it,positive,301
Operation_Performance,Machine,this is an excellent machine,positive,302
Design_Features,durability,good durability,positive,303
Operation_Performance,Performance,outstanding performance,positive,303
Design_Features,portability,portability,positive,303
Customer_Service,response,response is excellent,positive,304
Design_Features,Battery,battery life appears to be excellent,positive,305
Design_Features,Ports,generous selection of ports,positive,307
Design_Features,Laptop,"LAPTOP is sleek and dare i say, sexy",positive,308
Operation_Performance,CPU,i enjoy the processing speed of this model,positive,309
Shipping,Shipping,fast shipping,positive,310
Product,Product,product exactly as described,positive,310
Product,Authenticity,authentic apple,positive,310
Product,Condition,new,positive,310
Product,Packaging,factory sealed in box,positive,310
Design_Features,Display,loving the sharp display,positive,311
Design_Features,Trackpad,and the track pad,positive,311
Design_Features,Laptop,how light and speedy it is,positive,312
Design_Features,Laptop,they put a lot of thought and work into making sure that the hardware and software work real well together,positive,316
Operation_Performance,Computer,obviously great computer,positive,317
Design_Features,Laptop,very nice laptop,positive,318
Design_Features,Portable,i love its portable feature,positive,318
Operation_Performance,Running Speed,the running speed is very fast,positive,318
Operation_Performance,battery life,the only issue i have with it ( and hence the four star rating ) is the battery life,negative,319
Shipping,Shipping,the shipping was fast,positive,322
Seller,Seller,and the seller was great,positive,322
Design_Features,Design,the design is beautiful,positive,324
Design_Features,Track Pad,the force feedback track pad is amazing,positive,324
Design_Features,Touchpad,"force touch trackpad, pretty freakin awesome",positive,327
Design_Features,Mac,the programs that come with it,positive,330
Operation_Performance,Mac,how the mac itself functions,positive,330
Design_Features,Mac,the appearance and quality of the mac,positive,330
Operation_Performance,Battery,"battery life thus far isn ' t nearly as long as i thought it would be , based upon video reviews of this model and item description . ",negative,331
Recommendation,Macbook,"if you ' re considering getting this macbook , proceed with confidence . ",positive,333
Operation_Performance,Hard Drive,the ss hard drive has next to zero lag over traditional drives,positive,334
Operation_Performance,meeting my expectations,it ' s far away from meeting my expectations,negative,335
Design_Features,Laptop,it isn't bulky,positive,336
Customer Service,Customer Service,great price and customer service,positive,337
Design_Features,Laptop,"however, i have an iphone and an ipad and the macbook does a great job syncing up everything on all three devises.",positive,338
Operation_Performance,Laptop,laptop works perfect,positive,339
Design_Features,Charger,i did get a used charger that only lasted a week,negative,339
Price,Apple,costs a few bucks $ $ $ more,negative,341
Quality,Apple,but apple products are the best on the market,positive,341
Operation_Performance,Video,This computer is great for playing videos,positive,342
Connectivity,HDMI,connecting to an hdmi tv,positive,342
Design_Features,Battery,has a fantastic battery life,positive,342
Price,Price,great price,positive,343
Operation_Performance,Computer,great computer,positive,344
Design_Features,Model,the new 2016 model,negative,347
Design_Features,Ports,lack of ports,negative,347
Design_Features,Magsafe Connector,magsafe connector,negative,347
Shipping,Shipping,shipping was fast,positive,348
Product,Product,product came as described,positive,348
Operation_Performance,Apple Updates,apple updates are easy,positive,349
Shipping,arrival,it arrived in great condition,positive,350
General,working,it ' s been working perfectly for me since i got it,positive,350
Operation_Performance,System,the system was somewhat glitchy for the first couple of weeks,negative,353
Operation_Performance,Chrome OS,seemed to be a problem with the chrome os,negative,353
Operation_Performance,Chrome OS,it was fixed by the next update,positive,353
Design_Features,Screen,screen stays in whatever position you put it solidly enough to use the touchscreen,positive,355
Sound,Speakers,speakers are a little tinny,negative,357
Sound,Volume,the volume is awesome,positive,357
Operation_Performance,Chrome OS,it's not possible to customize the equalizer on the chrome os right now,negative,357
Design_Features,Tablet,"if you want a true tablet, buy a true tablet",negative,358
Design_Features,Tablet,this did honestly keep me from investing in a kindle as i was planning to,negative,358
Design_Features,Keyboard,"that it is only as big as it needs to be to have a full - size keyboard ( not with a number pad , but full - sized keys )",positive,359
Operation_Performance,Update,update it as soon as you turn it on,positive,360
Operation_Performance,laptop,my trusty windows 7 laptop was on its last leg,negative,361
Operation_Performance,laptop,i opted to try something new,positive,361
Design_Features,Touchscreen,the touchscreen looks good and is responsive,positive,363
General,Keyboard,the keyboard is nice,positive,363
Usefulness,Chromebooks,Chromebooks are useless without internet access,negative,364
People,People who complain about chromebooks,people who complain that chromebooks are useless without internet access,negative,364
Design_Features,Screenwriting App,"so I went to install my favorite screenwriting app, Trelby, ",positive,365
Operation_Performance,Availability,only to find its not available,negative,365
Operation_Performance,Internet Connection,maybe this thing does suck without an internet connection,negative,366
Design_Features,Desktop,"i realized that i can use my studio desktop wherever i want , whenever i want",positive,367
Design_Features,Button,it does make quite a loud click when you depress the button,negative,368
Design_Features,Laptop,a quiet fan - less device that doesn't heat up too much,positive,370
Purchase,Return Policy,due to the excellent return policy,positive,372
Sound,Pandora,i downloaded pandora and listened to all my stations at 3 / 4 volume and it sounded fine,positive,373
Operation_Performance,Start Up,i had to look up keys to press to get into a start up mode to even set up the computer,negative,376
Operation_Performance,OS,Mac ' s OS,negative,377
Operation_Performance,Services,its glitchy services,negative,377
Operation_Performance,Battery,the battery is ok,positive,378
Design_Features,Aesthetics,its very aesthetically pleasing,positive,378
Design_Features,Macbook Pro,ordered a macbook pro 13inch 256gb from this seller,positive,379
General,Power Button,the power button,negative,379
General,Keyboard,the keyboard,negative,379
General,Trackpad,the trackpad,negative,379
Design_Features,Charger,the charger does look great coming out of the box,positive,382
Design_Features,Charger,plan on buying another shortly thereafter,negative,382
Operation_Performance,Patience,as long as your patience holds up,neutral,382
Customer_Service,Apple,do not waste your time calling apple to see if there is anything they can do about it after 1 year,negative,383
Cost,Apple Care,unless of course you want to pay even more money on ' apple care ',negative,383
Design_Features,Coating,the anti - reflective coating will wear off,negative,385
Warranty,Apple,it isn ' t covered under apple ' s warranty,negative,385
Dependability,Macbook Pro,the macbook pro offers a very dependable machine,positive,386
Operation_Performance,Macbook Pro,that will muddle - through anything you throw at it without complaining,positive,386
Design_Features,Ports,2 usb ports and 2 thunderbolt ports,positive,387
Price,Laptop,$ 4500nz laptop,negative,387
Design_Features,SSD Drive,the ` ` ssd drive ` `,negative,388
Design_Features,Charger,the charger is defective,negative,389
Design_Features,Charger,after 45 days of use the charger is shot,negative,389
Design_Features,Keyboard,i love the keyboard,positive,391
Design_Features,Trackpad,and the trackpad,positive,391
General,Reviews,i finally get it now why both of these have rave reviews,positive,391
Battery,Battery,the battery life is good,positive,392
Battery,Battery,i get about 5 - 6 hours of non stop typing,positive,392
Purchase,Amazon,didn ' t purchase from amazon,negative,394
General,Laptop,but i can not believe these laptops have 5 stars,negative,394
Operation_Performance,Booting,it stopped booting,negative,395
Operation_Performance,laptop,it is not worth it,negative,399
Design_Features,Apple,"apple , a supposed industry leader , ",negative,400
Operation_Performance,Functionality,has such horrendous functionality,negative,400
Purchase,Notebook,i purchased this notebook back in july,positive,401
General,Notebook,was initially happy with my purchase,positive,401
Customer_Service,Warranty,"after numerous calls, i then received confirmation the warranty was valid, but only as a 'one-off'",negative,402
General,Reputation,has a horrible reputation,negative,403
Design_Features,Screen,"bright enough for all uses, and 1080p is perfect - images are sharp.",positive,405
Operation_Performance,battery life,battery life is solid,positive,406
Design_Features,battery life,right around what is claimed - probably 7 to 10 hours depending on variables such as screen brightness and how demanding you ' re being with it,positive,406
Design_Features,Touchscreen,touchscreen is responsive enough for gaming,positive,407
Operation_Performance,Chrome apps,i absolutely imagine chrome apps picking up drastically in quality and quantity now,positive,408
Operation_Performance,Chrome OS,since it seems like chrome os is really coming into its own this year,positive,408
Design_Features,Screen,"in tablet mode, the screen looks too 'tall' to feel natural (see the attached picture).",negative,409
Design_Features,Screen,This screen ratio makes it look great in desktop mode,positive,410
Operation_Performance,Battery,after 3 months of use the unit will no longer charge,negative,411
Operation_Performance,Software,"if it is indeed a software thing and it ' s fixed , ",positive,412
Recommendation,Device,i would highly recommend this device .,positive,412
Operation_Performance,UI,second issue is with scaling of the ui,negative,413
Design_Features,Screen,the screen itself is hd 1080p,positive,414
Design_Features,Resolution,but most ui elements don ' t look good in this resolution,negative,414
Design_Features,App,unless the app is specifically designed to access google drive files,negative,415
Design_Features,App,the app has no way to read and save files directly to the cloud,negative,415
Sound,volume,volume is incredibly low,negative,417
Design_Features,Chromebook,this beautiful asus chromebook,positive,418
Operation_Performance,Quick Fix,i would like a quick fix,negative,418
Operation_Performance,Battery,one night i plugged it in and woke up to a dead chromebook,negative,419
Design_Features,Weight,it ' s too heavy to really use as a tablet,negative,420
Operation_Performance,Transfer Speeds,transfer speeds ( lan to nas ) were miserably slow ( 10 - 30mbps ),negative,421
Design_Features,Laptop,"it was perfect with no backlight bleed, no shimmery matte texture, no uneven backlight, no dead / stuck pixels",positive,422
Operation_Performance,power supply,it was clear this was a power_supply issue,negative,424
Price,Price,nearly $ 500,negative,425
General,Lifespan,only last a year,negative,425
Price,Price,this price point,negative,425
Operation_Performance,OS,were limited by the os,negative,426
Reviews,Chromebook,it still rates ( on several tech sites ) as one of the best overall chromebook lines to get,positive,428
Customer_Service,Customer Service,the asus customer service people are rude,negative,429
Customer_Service,Customer Service,and have no answers,negative,429
Operation_Performance,Unit,things were fine until the unit stopped charging,negative,430
General,Companies,This is the problem with companies today,negative,431
Customer_Service,Customer Service,asus customer service sucks,negative,432
Customer_Service,Customer Service,i call customer service,neutral,433
Customer_Service,Customer Service,first they argue and say customer damage,negative,433
Customer_Service,Customer Service,then to try and placate me they say they have an adp accidental damage and protection plan one time for one year,positive,433
Operation_Performance,Product,That's nutty for an expensive premium product,negative,435
Sentiment,Product,i seriously love the product,positive,437
Return Policy,Return,but i may have to return it,negative,437
Battery,Battery,now i only leave it charging until it ' s full but the battery time is still decreasing,negative,438
Operation_Performance,Chromebook,very impressed with my first chromebook,positive,439
Design_Features,Tablet,i don ' t use it as much in tablet mode as i thought,negative,440
Design_Features,Weight,as it is a little heavy when in that configuration,negative,440
Customer_Reviews,Tablet/Computer,based on customer reviews,positive,441
Operation_Performance,Google Docs,google docs work fine,positive,442
Use,Chromebook,a chromebook does most of what i need,positive,443
Use,Gaming,except gaming,negative,443
Operation_Performance,Cloud Print,it would not identify my printer in cloud print,negative,444
Operation_Performance,TPM,my tpm is no longer working,negative,445
Operation_Performance,Computer,the whole computer is useless,negative,445
Design_Features,Touchpad,the touchpad is very sticky,negative,447
Design_Features,Screen,the screen quality is just so-so,negative,448
Recommendation,Asus,not buy any asus product again,negative,449
Operation_Performance,Screen,the third one is ok but has a dead pixel,negative,450
Customer_Service,Amazon,i ' ve contacted amazon,negative,451
Customer_Service,Asus,and asus,negative,451
Customer_Service,response,and no response,negative,451
Operation_Performance,Chrome Extensions,several of my chrome extensions perform poorly,negative,453
Workflow,Chrome Extensions,which degrades my work production experience,negative,453
Sound,Speakers,the speakers on this thing are horrible,negative,454
Operation_Performance,Battery,battery life is not good,negative,455
Design_Features,Screen,but screen is very weird,negative,456
Operation_Performance,CPU,the intel m3 processor is amazing,positive,457
Operation_Performance,Multi-tasking,this thing can do a ton of multi-tasking,positive,457
Design_Features,Chromebook,the google play store is nice to have,positive,457
Operation_Performance,Android Apps,the android apps variants trump the chromebook pre-loaded apps,positive,457
Design_Features,Chromebooks,chromebooks are cool,positive,460
Operation_Performance,Chromebooks,but they dont last at all,negative,460
Operation_Performance,Machine,hey this machine is extremely useable and functionable,positive,461
Operation_Performance,Battery,battery no longer charging,negative,462
Operation_Performance,File System,the file system is extremely complicated to use,negative,463
Design_Features,Display,the display panel on the machine i received is warped,negative,464
Operation_Performance,Turn On,half the time it doesn ' t want to turn on,negative,465
Operation_Performance,Turn On,and just flashes,negative,465
Design_Features,Chrome OS,the whole concept of chrome os and cloud applications,negative,466
Operation_Performance,Rebooting,it rebooted,negative,467
Operation_Performance,Endless Boot Loop,went into an endless boot loop,negative,467
Operation_Performance,Factory Default,tried to reset it to factory default,negative,467
Operation_Performance,Chrome OS,says chrome os is missing or damaged,negative,467
Design_Features,Hinge,the screen hinge feels weak,negative,468
Design_Features,Screen,screen is average by 2017 standards,negative,469
Customer_Support,OS,google provides zeros customer support related to the os,negative,471
Operation_Performance,Product,horrible product,negative,472
Customer_Service,Tech Support,tech support is no help,negative,473
Customer_Service,Tech Support,unless you are willing to part with your computer for months without guarantee of return,negative,473
Operation_Performance,Chromebook,i am having a very difficult time with this chromebook,negative,474
Operation_Performance,Freezing,it freezes constantly,negative,475
Operation_Performance,Restarting,needs to be shut off to start again,negative,475
Design_Features,Microphone,the microphone does not work with regular speaker,negative,476
Design_Features,Tablet Mode,the tablet mode is horribly integrated with the os and applications,negative,477
Design_Features,Trackpad,mine came with an annoying trackpad,negative,481
Design_Features,Monitor,the top metal monitor casing seems to be soft and bendable,negative,482
Design_Features,Screen,mine arrived with the metal screen casing slightly bent,negative,483
Design_Features,Screen,i can easily bend it back,negative,483
Design_Features,Screen,not sure about the durability of this thing in the long term,negative,483
Operation_Performance,USB,a buzzing sound started coming out of the right side usb port,negative,484
Design_Features,Chromebook,chromebook with some manufacturing issues,negative,485
Customer_Service,Customer Service,bad customer service,negative,485
General,Chromebook,not worth it,negative,485
Design_Features,Screen,they 1080 screen,negative,486
Design_Features,Screen,makes the fonts to small for this size screen,negative,486
Operation_Performance,Chromium OS,Chromium OS,negative,487
Recommendation,Chromium OS,would not recommend it over a cheap Windows PC,negative,487
Design_Features,Touchpad,the touchpad is also some strange off color plastic,negative,489
Quality,Unit,the first unit i received shortly died after a few hours of usage,negative,493
Design_Features,Cooler Boost Button,I like the addition of the Cooler Boost button,positive,494
Design_Features,Thermaltake Auto Laptop Cooling Pad,I have a Thermaltake Auto Laptop Cooling Pad that monitors the bottom surface of my laptop,positive,494
Design_Features,Trackpad,trackpad is ok,neutral,495
Connectivity,Wireless,wireless card is finicky with both units i had,negative,496
Operation_Performance,Internet Connection,loses its internet connection at random times,negative,497
Technical_Support,Technical Support,after being on the phone with technical support and windows support for a combined 10 hours,negative,498
Technical_Support,Windows Support,after being on the phone with technical support and windows support for a combined 10 hours,negative,498
Hardware,Hardware,i am told that the hardware is defective and must be replaced,negative,498
Operation_Performance,Machine,run like heck from this machine,negative,499
Operation_Performance,It,it will break,negative,500
Operation_Performance,It,even if it works at first,negative,500
Operation_Performance,Laptop,"literally just closing it and opening it up later was a 50 / 50 proposition if it would wake up , or the display would crash , or the disk would crash , or some driver would fail - on a brand new laptop .",negative,502
Design_Features,Machine,hook up the cat5 and the machine is screaming at high speed and exactly what i was hoping for,positive,503
Operation_Performance,Drivers,uninstall / install the drivers in exactly the correct order,positive,505
Operation_Performance,Windows 10,do a clean win 10 installation yourself,positive,505
Operation_Performance,Laptop,this laptop should perform well for the price,positive,505
Sound,Sound,the sound is really terrible and tinny,negative,506
Operation_Performance,CPU,it ' s fast,positive,507
Operation_Performance,Battery,it was actually more like 1h45m and this was also after optimizing the battery,negative,510
Operation_Performance,Laptop,it stopped booting,negative,511
Operation_Performance,Device,"for the four days i used it, ",positive,512
Customer_Service,Tech Support,we call tech support together and the guy who answers is just so not interested in helping,negative,514
Operation_Performance,laptop,i am extremely disappointed with this laptop,negative,515
Operation_Performance,Computer,this is by far and away the worst computer i have ever purchased,negative,516
Operation_Performance,Laptop,this kept plaguing the laptop as more problems kept piling up including various bsod errors mostly involving the hardware,negative,518
Design_Features,Design,poor design,negative,519
Operation_Performance,Tech Support,terrible tech support,negative,519
Customer_Service,Support,"their support page is very buggy, and the support people are unhelpful",negative,524
Operation_Performance,Optane Drive,i ' m pretty much avoiding the optane drive,negative,525
Customer_Service,Product,after this issue i finally decided to return my product,negative,526
Customer_Service,Tech Support,good luck this customer tech support,negative,527
Customer_Service,MSI,and msi has absolutely no idea how to help you,negative,527
Operation_Performance,Laptop,i've had to do a factory reset on this piece of garbage 4 times and i've only owned it for 4 months,negative,528
Design_Features,Laptop,you can feel the plastic bending if you pick up the laptop with one hand,negative,529
General,MSI,i will never own another msi product,negative,531
Operation_Performance,Windows,even when i reinstalled windows it was so slow,negative,534
Build_Quality,Product,there are clearly serious build defects / instabilities on this product,negative,534
Operation_Performance,Functionality,when it is functioning,positive,535
Operation_Performance,Functionality,it works great,positive,535
Operation_Performance,CPU,it has a slow processor,negative,536
Operation_Performance,Laptop,laptop malfunctioned and stopped working,negative,538
Design_Features,Screen,"it does have a nice screen that is very bright, decent viewing angle and ok for contrast",positive,539
Design_Features,Keyboard,the keyboard is very nice,positive,540
Design_Features,Keyboard,and very responsive,positive,540
Operation_Performance,Bootup Time,fast bootup time,positive,541
Design_Features,Optane Memory,optane memory,positive,541
Operation_Performance,SSD,nice alternative to a very expensive ssd,positive,541
