category,aspect,segment,sentiment,review_id
Battery,charge,the charge doesn ' t last like the five hours it stated,negative,542
Battery,hours,but instead last three hours,negative,542
Operation_Performance,Problems,riddled with problems,negative,543
Operation_Performance,Hard Drive,the only downside is the slow 5400 rpm 1 tb hard drive,negative,544
Use,Laptop,"used as bought , it is an ok laptop , but not great ( probably a 3 star value ) .",negative,546
Design_Features,Ethernet Port,no ethernet port,negative,547
Operation_Performance,CPU,it has plenty of power for most tasks,positive,549
Operation_Performance,Hard Drive,the only weak point of the laptop is the hard drive it come with,negative,550
Design_Features,Laptop,but luckily this laptop is extendable - 2 ram slots and one m . 2 ssd slot,positive,550
Price,Notebook,i paid $ 500 for a 15 ` ` notebook,positive,551
Operation_Performance,RAM,with 8gb ram,positive,551
Operation_Performance,CPU,latest i5 - 8250u cpu,positive,551
Design_Features,Notebook,with reasonable weight,positive,551
Design_Features,Notebook,and its quite extendable,positive,551
Design_Features,Button Placement,delete and power button being next to each other,negative,552
Design_Features,Button Placement,now i see what the other people are complaining about accidentally shutting it off,negative,552
General,Product,haven ' t had any issues yet so pretty glad i chose this,positive,553
Design_Features,Windows 10,features windows 10,positive,555
Design_Features,Display,sharp display,positive,555
Design_Features,Card Slot,card slot for m . 2 ssd,positive,555
Quality,Computer,great quality computer,positive,556
Design_Features,Build Quality,has good build quality,positive,557
Operation_Performance,Computer,so far it has been able to handle everything i ' ve thrown at it,positive,558
Overall,all in all,"all in all, pretty good stuff",positive,559
Operation_Performance,Windows 10,after updating windows 10,negative,562
Design_Features,Hardware,excellent hardware,positive,562
Operation_Performance,Computer,"so , shortly after buying it i had to format it",negative,563
Operation_Performance,Battery,the computer says it is plugged in but not charging,negative,564
Operation_Performance,Fingerprint reader,the fingerprint reader works most of the time,positive,565
Sound,Sound,the sound is fine for me,positive,566
Sound,Sound,but not as good as external speakers,negative,566
Operation_Performance,Boot_up_time,not that this machine boots up slow,negative,567
Value,Laptop,great value for a laptop,positive,568
Design_Features,Screen,love the 15 inch screen,positive,569
Design_Features,Body,in the body of a 14 inch body,positive,569
Design_Features,Laptop,cheaply made plastic,negative,570
Operation_Performance,Laptop,performance is well worth the trade for a $ 500 laptop,positive,570
Design_Features,Touchpad,touchpad works well,positive,571
Sound,Speakers,the speakers are mediocre,negative,572
Sound,Volume,don ' t put out too much volume,negative,572
Sound,Position,are sensitive to position,negative,572
Design_Features,Screen,"i do like the screen on this, images are clean and crisp, enjoying the 4 gigs of ram which allow me to have a few more tab open.",positive,573
Value,Price,because of its cheap price,positive,575
Design_Features,Chromebook,"the perfect weight, size, and design",positive,576
Use,College,upcoming college semester,neutral,576
Operation_Performance,Laptop,"laptop would never power on, even after being charged for 24 hours",negative,577
Operation_Performance,SSD,ssd hardware issue,negative,580
Amazon_Service,Refund,"support for amazon is making it good and immediately sent me the return label , bought through third party but i will get my money back , thank god for amazon customer service",positive,581
Operation_Performance,Battery,it doesn ' t stay on,negative,583
Design_Features,Keyboard,they keyboard felt responsive and was a good size,positive,584
Operation_Performance,Acer product,never buying another acer product ever again,negative,585
Design_Features,Screen Brightness,below average screen brightness about 200 nits,negative,589
Design_Features,Screen Brightness,average is 250 - 275,positive,589
Operation_Performance,Reviews,as you can see from the reviews,positive,590
Operation_Performance,People,it worked out fine for most people,positive,590
Operation_Performance,Acer Aspire E 15,my acer aspire e 15 worked great for a day,positive,592
Operation_Performance,Acer Aspire E 15,and then shut off by itself,negative,592
General,Keyboard,the keyboard stopped working,negative,593
Operation_Performance,Price,good performance for the price,positive,595
Operation_Performance,Intention,my intention as the support for my family was to have everyone on these with a spare to deal with ones that break down,positive,595
Purchase,Computer,i purchased this computer,positive,596
Recommendation,Computer,"it came highly rated by consumer reports, pc magazine, and other raters",positive,596
Operation_Performance,Screen,i too have the black screen problem,negative,599
Operation_Performance,Computer,computer is fine,positive,600
Design_Features,Speakers,the speakers broke after 1 week of use,negative,600
Value,Price,the computer is good for the price,positive,601
Design_Features,HDMI Port,but the hdmi port is already broken,negative,601
Operation_Performance,Laptop,"won ' t turn on , won ' t charge , have to send it to tx to be repaired . ",negative,602
Use,Laptop,this is not a game laptop,negative,603
General,Reviews,as many have reviewed it as,neutral,603
Battery,Battery Life,battery life can last me roughly 5 or 6 hours on internet usage alone with multiple tabs,positive,604
Design_Features,Speakers,the speakers on the bottom,negative,605
Design_Features,Speakers,take a moment to get used to,negative,605
Design_Features,Speakers,but after that it's alright,positive,605
Design_Features,Laptop,overall the laptop is cheap and flimsy,negative,607
Operation_Performance,GPU,mx150 gaphics card is also pretty bad,negative,608
Operation_Performance,Computer,i took it to my local computer repair,negative,610
Operation_Performance,Board,who states it has a bad board,negative,610
Operation_Performance,Laptop,there ' s something wrong with my laptop,negative,611
Operation_Performance,Power Management,something is wrong with the power management,negative,612
Price,E15,$600 E15,negative,613
Design_Features,No Frills,no frills,positive,613
Design_Features,Plain Old,plain old,positive,613
Price,15,<$200 15,positive,613
Operation_Performance,Trackpad,the trackpad stopped working after four weeks of using it,negative,614
Design_Features,Screen,there is a flicker in the middle of the screen,negative,615
Operation_Performance,Computer,the computer runs decent,positive,616
Design_Features,Keypad,the keypad turns off every time the computer sleeps,negative,616
Operation_Performance,Device,"otherwise, so far it is working well",positive,617
Quality,Machine,a gift of a defective machine,negative,618
Operation_Performance,Computer,the computer itself is actually quite fast with the ssd and processor,positive,619
Experience,Experience,so my experience there so far has been good,positive,619
Design_Features,Keyboard,keyboard and track pad shoved way left,negative,620
Design_Features,Keyboard,keyboard rattles loudly when typing on left side,negative,621
Connectivity,WiFi,will not connect to wifi,negative,622
Display,Screen,amd screen flashes when adjusting while on,negative,622
Design_Features,Keyboard,key presses are too stiff to press,negative,627
Operation_Performance,HDD,hdd makes this laptop very slow,negative,628
Design_Features,Asus Engineers,Asus engineers designed the case and laptop not to be opened by users,negative,629
Design_Features,Keyboard,there is no backlight and keys are too stiff,negative,630
Operation_Performance,Linux,linux is mostly compatible with this laptop,positive,632
Design_Features,Fingerprint Reader,except fingerprint reader,negative,632
Operation_Performance,Video Converting,video converting process with same video file took only 25 minutes,positive,633
Design_Features,Asus Vivobook,with asus vivobook f510ua,positive,633
Design_Features,Screen,you can hear the screen creak,negative,634
Design_Features,Connection,it doesn ' t support a hardwire connection,negative,635
Operation_Performance,Software,i have installed no software on it yet it updates something every day and wants to reboot,negative,636
Operation_Performance,Laptop,it just locked up again,negative,637
Sound,loudness,did i mention it sounds like a lawn mower ?,negative,638
Design_Features,Screen,i will say i do enjoy the screen quality,positive,639
Operation_Performance,WiFi,the wifi is fast on this laptop,positive,639
Operation_Performance,in all,in all,negative,640
Recommendation,stay away,stay away,negative,640
Design_Features,Trackpad,finger doesn ' t side smoothly along track pad,negative,642
Price,Return,i had to spend over $ 160 to return it,negative,644
General,Asus,i will never buy an other asus product,negative,645
Operation_Performance,Computer,"it just crashed, dead",negative,646
General,Keyboard,the keyboard is awful,negative,648
Customer_Service,ASUS,"when i asked asus for a replacement key , they said i ' d have to ship it back to them , which would have left me without a computer for 2 weeks .",negative,649
Operation_Performance,Product,don ' t buy it,negative,650
Operation_Performance,Boot up,after my 3rd boot up,negative,651
Design_Features,Laptop,it's damaged,negative,651
Operation_Performance,Disk,disk ( c : ) runs at 100 % all the time,negative,652
General,everything else,everything else is very good,positive,653
General,purchase,and i am satisfied with the purchase,positive,653
Operation_Performance,CPU,do not buy this computer if your plan is to multitask,negative,654
Operation_Performance,Games,play an occasional game,negative,654
Sound,Music,play music,negative,654
Operation_Performance,Web_Browsing,searching the web,negative,654
Design_Features,Fingerprint scanner,the fingerprint scanner is half jotted and barely works,negative,657
Design_Features,Screen,the screen turns itself off and logs you out whenever it feels to do so,negative,658
Operation_Performance,Fingerprint scanner,finger print scanner not working whatsoever,negative,659
Design_Features,Touch Pad,poor touch pad,negative,661
Operation_Performance,Touch Pad,it get stuck,negative,661
Design_Features,Physical_Case,the physical case is solid,positive,662
Design_Features,Production_Quality,of a production quality,positive,662
Price,Price,3 - 5x the price of this machine,negative,662
Operation_Performance,Games,I've loaded a number of games,positive,665
Operation_Performance,Productivity Apps,several productivity apps,positive,665
Design_Features,Skype,Skype,positive,665
Design_Features,Spotify,Spotify,positive,665
Operation_Performance,Android Apps,some network scanning android apps,positive,665
Design_Features,Mouse and Trackpad Settings,mouse and trackpad settings are very minimalist,negative,666
Design_Features,Short-cut Keys,there's no way to modify short-cut keys,negative,666
Operation_Performance,Power Management,"power management options are pretty minimal, too",negative,666
Design_Features,Laptop,It's really seamless and smooth to move back and forth,positive,668
Operation_Performance,Linux,and makes experimenting with different linux configs and environments effortless,positive,668
Design_Features,Screen Protector,"for ~ $ 15 you can get a nice , fitted anti - glare screen protector that reduces the fingerprint / glare problems and gives you some piece of mind about protecting that gorgeous screen",positive,670
Operation_Performance,CPU,intel core m3 processor,positive,671
Operation_Performance,Apps,"apps like microsoft word, excel, etc run wonderfully",positive,672
Operation_Performance,Android Youtube App,doesn't work well at all,negative,673
Design_Features,Full-Screen Mode,inconvenient to get videos into full-screen mode,negative,673
Operation_Performance,CPU,it seems pretty fast,positive,674
Operation_Performance,Chromebook,so i ' m very happy and relieved to see it working excellently on the c302 .,positive,675
Design_Features,Battery,battery life is great,positive,677
Design_Features,Backlight,the backlight works great,positive,678
Design_Features,Use in the dark,i had no problems using it in the dark,positive,678
Design_Features,Surface,It's a nice smooth surface,positive,679
Design_Features,Surface,so no tension when gliding across it,positive,679
Design_Features,Touchscreen,multi - touch input works great,positive,680
Operation_Performance,Startup,it starts up,positive,683
Operation_Performance,Runtime,runs without issues,positive,683
Sound,Speakers,even the speakers are way better than i expected from a 2 in 1 at this price point,positive,684
Price,Chromebook,not a $1300 pixel,positive,685
Design_Features,Screen,"the screen has great contrast, is glossy, and sharp",positive,686
Design_Features,Screen,the screen was a tad bit brighter,negative,687
Operation_Performance,CPU,"it ' s faster , ",positive,690
Design_Features,Screen,"the screen is much nicer , ",positive,690
Storage,Memory,it has twice the memory ,positive,690
Storage,Drive,and four times the drive space .,positive,690
Design_Features,Chromebook,"the core m3 processor allows the c302 to be fanless, as well, adding to the sleek design.",positive,691
Operation_Performance,Time,"it ' s a real timesaver , ",positive,692
Design_Features,Display,i find the display sharp,positive,693
Design_Features,Touch,and touch responsive to be quite excellent,positive,693
Value,Extra Cost,i think it is worth the extra cost,positive,694
Design_Features,Product,if you are looking for a premium product,positive,694
Operation_Performance,Product,feel,positive,694
Operation_Performance,Battery,battery doesn ' t last nearly as long as advertised,negative,696
Design_Features,Machine,this is a very cleverly designed and fast machine,positive,697
Operation_Performance,Operational_Speed,likely the fastest laptop i have ever used ( for basic functions ),positive,698
Operation_Performance,Everything,everything is working great,positive,699
Design_Features,Trackpad,trackpad isn't the best,negative,700
Design_Features,Touchscreen,the touch screen isn't as accurate as I wish,negative,701
Design_Features,Touchscreen,for cases like tapping tiny things around the edges,negative,701
Design_Features,Screen,the screen size is an awkward 16 : 9 and provides a 1920x1080 resolution ( although the default is set to 1536x864 ),negative,702
Design_Features,Chromebook,"for 99 % of the people looking at chromebooks right now for personal use, ",positive,703
General,ASUS,this asus is probably the best choice in the market,positive,703
Operation_Performance,Chromebook,i am extremely impressed with this chromebook,positive,704
Recommendation,Chromebook,would highly recommend this to others,positive,704
Operation_Performance,Tablet,it works well as a tablet,positive,705
Operation_Performance,Laptop,it works great as a laptop,positive,706
Operation_Performance,Web_Based,for the things i do which tend to be web based,positive,706
Design_Features,Display,"i found the display to be very vibrant, with excellent pixel density",positive,708
Design_Features,Ports,dispersion of ports,positive,709
Design_Features,Ergonomics,helps with the ergonomics of your daily usage,positive,709
Price,450,for $ 450,positive,710
Design_Features,Screen,the screen,positive,710
Design_Features,Build Quality,the excellent overall build quality,positive,710
Value,Price,at a respectable price,positive,711
Operation_Performance,Chrome OS,the best premium chrome os experience,positive,711
Design_Features,Screen,the screen is fantastic,positive,712
Design_Features,Mousepad,the mousepad feels very comfortable to use,positive,713
Operation_Performance,Battery,the battery performance is all it ' s cracked up to be,positive,714
Sound,Sound,the sound is rich and plenty loud enough,positive,715
Sound,Sound,but it won ' t replace your music system,negative,715
Design_Features,Keyboard,backlit allow even guys with large hands to use this keyboard comfortably in any lighting,positive,716
Design_Features,Trackpad,the trackpad is excellent,positive,717
Design_Features,Touchscreen,the touchscreen is excellent,positive,717
Sound,Speaker,the speaker sound is ok,positive,718
Sound,Speaker,but not great,negative,718
Design_Features,Chromebook,i really do love this chromebook because it provides a large amount of utility and is perfect for a university setting and environment,positive,719
Design_Features,USB-C Ports,the USB-C ports are working well,positive,720
Design_Features,Multiple Port Adapter,"I bought a multiple port adapter, which gives me a regular USB port along with a HDMI port and another USB-C port for charging",positive,720
Design_Features,Speakers,good speakers,positive,721
Design_Features,Speakers,but not the loudest,negative,721
Design_Features,Device,the device is so sturdy and clean looking,positive,722
Design_Features,Touchscreen,the touchscreen is very responsive,positive,723
Design_Features,Tablet Mode,and works great in tablet mode,positive,723
Battery,Battery,the battery life is touted as 10 hours,positive,724
Battery,Battery,but i find that 7,negative,724
Battery,Battery,single battery charge can last 13 - 9 hours depending on wifi / video / app demand,positive,726
Operation_Performance,Touchscreen,the touchscreen works very well,positive,728
Operation_Performance,Android_Apps,and android apps are working right now,positive,728
Operation_Performance,Chrome_OS,if you ' re on the beta channel for chrome os,positive,728
Design_Features,Tablet Mode,not especially comfortable to use in tablet mode,negative,732
Design_Features,Bezel,edges of the bezel are little too ` ` sharp ` ` to comfortably rest your palms,negative,732
Design_Features,Weight,"2 . 4 pounds , it ' s a bit too heavy to hold for long periods of time",negative,732
Design_Features,Laptop,as a laptop,positive,733
Design_Features,Size,this is just the size i need,positive,733
Design_Features,Keyboard,the keyboard is often praised,positive,734
General,Keyboard,but i don't find it particularly spectacular,negative,734
Design_Features,Battery,the battery life seems just as promised,positive,736
Design_Features,Keyboard,the keyboard is comfortable to type on,positive,737
Operation_Performance,Keyboard,although i haven ' t done so for more than a 1 - 2 hours,negative,737
Design_Features,Screen,the screen is clear and bright,positive,738
Operation_Performance,System,the system doesn't lag unless I have a large number of tabs open,neutral,738
Use_Case,Work,I write a lot for work,positive,739
Use_Case,Daily_Driver,"use a chromebook as my daily driver for notes , word processing , spreadsheets , etc .",positive,739
Operation_Performance,Wireless,it found and connected to my wireless printer also with no problems,positive,741
Operation_Performance,Computer,i now feel like this could be my main computer for work and fun,positive,743
Recommendation,ASUS Flip 302,give the asus flip 302 consideration,positive,744
Operation_Performance,Battery,its battery life is quite good,positive,745
General,Keyboard,the keyboard experience is great,positive,745
Design_Features,Headphones,i plugged in regular headphones,negative,747
Operation_Performance,Sound,it was horribly low - very unenjoyable to listen to music this way,negative,747
Design_Features,Keyboard,nice sized keyboard,positive,748
Operation_Performance,Tablet,works great as a tablet,positive,748
Operation_Performance,Tablet,even shuts off the keyboard in tablet mode,positive,748
Design_Features,Size,perfect size to use in bed,positive,750
Design_Features,Brightness,nice and bright,positive,750
Design_Features,Laptop,it ' s super thin and super light,positive,752
Design_Features,Laptop,fits in my backpack without all the added weight of a small 13 ` ` laptop,positive,753
Design_Features,Picture Quality,the picture quality is very good,positive,755
Operation_Performance,Book,the book itself is responsive and fast,positive,755
Recommendation,ASUS C302,I can't recommend the ASUS C302 enough.,positive,756
Operation_Performance,Keyboard,the keyboard itself is probably the one physical weak point,negative,757
Operation_Performance,Touchscreen,the touchscreen works well,positive,758
Operation_Performance,laptop,"but, it does work",positive,759
Design_Features,laptop,and is handy,positive,759
Sound,Sound,sound is really low while using an aux speaker / headphone,negative,761
Operation_Performance,Battery,the battery life is stunning,positive,764
Design_Features,Chromebook,"the asus chromebook flip 302ca is smooth, fast and incredibly well engineered and built.",positive,767
Design_Features,Screen,the screen resolution is great,positive,768
Design_Features,Touchpad,the touch pad is accurate,positive,769
Design_Features,Screen Brightness,i wish there was a way to default the screen brightness,negative,770
Design_Features,Keyboard Backlight,as well as default the keyboard backlight to off,negative,770
Value,Price,at a $ 500 price tag,negative,771
Value,Price,i was a little hesitant to pull the trigger,negative,771
Value,Price,but at this point i am very pleased with the purchase,positive,771
Value,Price,and i believe it is worth the price,positive,771
Design_Features,Keyboard,keyboard is comfortable,positive,773
Design_Features,Screen,screen is sharp,positive,773
Design_Features,Portability,its very portable,positive,774
Design_Features,Battery,battery should last full day of normal usage,positive,774
Design_Features,Chromebook,this chromebook,positive,775
Design_Features,Touch Screen,the touch screen is really accurate,positive,776
Design_Features,360 Flip,the 360 flip feature is really easy,positive,776
Operation_Performance,Mode Switching,i can switch to tablet mode anytime,positive,776
Design_Features,Use as Laptop,although i use this much more often as a laptop,positive,776
Operation_Performance,Computer,great computer,positive,778
Price,Price,especially for the price,positive,778
Design_Features,USB,two usb - c for charging,positive,779
Price,Chromebook,price is a bit expensive for a chromebook,negative,780
Use,School,it ' s perfect for school,positive,781
Use,Web Browsing,surfing the web,positive,781
Use,Video Watching,watching videos,positive,781
Connectivity,WiFi,the wifi connectivity is strong and consistent in my experience,positive,784
Design_Features,Screen,the screen isn't bright enough,negative,785
Design_Features,Speakers,the speakers aren't louder,negative,785
Operation_Performance,CPU,"dh54 gets the job done for work that doesn ' t require multiple cores for rendering , weight painting or ripping . ",positive,786
Design_Features,Graphics,the graphics are great,positive,787
Study,Information Technology,i'm in college right now studying information technology,positive,788
Operation_Performance,Computer,it's been able to do everything i've needed,positive,788
Price,Chromebook,it ' s a bit pricey for a chromebook,negative,789
Value,Chromebook,but worth it right now,positive,789
Operation_Performance,OS,does not run the native android versions of microsoft office,negative,790
Recommendation,Product,they should warn you about that,negative,790
Design_Features,Product,"This is a small, well built product",positive,792
General,Usage,ideal for general usage,positive,792
Design_Features,Screen,the screen resolution is also very good,positive,793
Design_Features,Screen,when watching movies or viewing photos,positive,793
Recommendation,Product,i would highly recommend this !,positive,794
Design_Features,Backlight,i love the backlight,positive,795
Design_Features,Backlight,it ' s not so bright as to blind you at night time,positive,795
Design_Features,Speakers,"speaker ' s are ok but not amazing , ",negative,796
Design_Features,Speakers,i do like that they are mounted on the sides so they work well in laptop or tablet mode equally well . ,positive,796
Apps,Play Store Apps,being able to use play store apps has been a huge plus,positive,797
Comfort,Google Docs,"i ' m now so comfortable with google docs , i ' very already forgotten i even owned a windows laptop",positive,797
Design_Features,Screen,but this screen is really good,positive,798
General,Keyboard,the keyboard,neutral,798
Design_Features,Form Factor,and form factor are much better,positive,798
Design_Features,Aspect Ratio,the 2 - 1 aspect,positive,799
Design_Features,Tablet Mode,folded into tablet mode,positive,799
Design_Features,Design,there aren't any weird grooves on the sides,positive,799
Design_Features,Computer,the computer itself is not bad,positive,800
Design_Features,Rotation,the 360 rotation,positive,800
Design_Features,Touch Screen,touch screen feel good,positive,800
Battery,Battery,battery life is amazing,positive,801
Design_Features,Laptop,in laptop form,negative,803
Operation_Performance,Overall,it ' s mediocre at best,negative,803
Design_Features,Chromebook,this chromebook is really one of the best you can own,positive,804
General,Laptop,in my opinion one of the best laptops in general,positive,804
Design_Features,Battery,the battery life is great,positive,805
Design_Features,Touchscreen,i love the touchscreen,positive,805
Design_Features,Flip,flip feature,positive,805
Design_Features,USB,audio quest dragonfly is automatically detected and runs perfectly when attached to one of the usb - c ports,positive,806
Design_Features,Keyboard,the keyboard is backlit,positive,807
Design_Features,Keyboard,big enough for my fingers,positive,807
